aid,publication_date,title,url,publisher,country,status,source_name
20180802071819439,2018-08-02T11:54:00Z,′No sign of torture′ on bodies of Russian journalists slain in CAR | Africa | DW | 02.08.2018,http://www.dw.com:80/en/no-sign-of-torture-on-bodies-of-russian-journalists-slain-in-car/a-44924309?maca=en-rss-en-all-1573-rdf,,"Central African Republic,Democratic Republic of the Congo,Federal Democratic Republic of Ethiopia,Federal Republic of Germany,Federal Republic of Nigeria,Kingdom of Morocco,Republic of Burundi,Republic of Cote d'Ivoire,Republic of Djibouti,Republic of Ghana,Republic of Kenya,Republic of Liberia,Republic of Mali,Republic of Sierra Leone,Republic of Uganda,Republic of the Congo,Republic of the Sudan,Russian Federation,Somalia,South Sudan,Syrian Arab Republic,Western Sahara",relevant,Web
20180611081816775,2018-06-11T12:31:00Z,African refugees′ success stories | Africa | DW | 11.06.2018,http://www.dw.com:80/en/african-refugees-success-stories/a-44156803?maca=en-rss-en-all-1573-rdf,,"Somalia,South Sudan",relevant,Web
20190623231126461,2018-06-28T05:00:00Z,"UN: 10,000 children killed, maimed in conflicts worldwide",https://advance.lexis.com/api/document?collection=News&id=urn:contentItem:5SNH-TMB1-DYN6-W0VS-00000-00&context=1516831,The Associated Press (same day),"Central African Republic,Democratic Republic of the Congo,Federal Republic of Nigeria,Kingdom of Saudi Arabia,Republic of Iraq,Republic of Yemen,Somalia,South Sudan,Syrian Arab Republic,Union of Burma,United Arab Emirates,United States",relevant,BulkLexisNexis_v2
20190623231126373,2018-06-28T05:00:00Z,"UN: 10,000 children killed, maimed in conflicts worldwide",https://advance.lexis.com/api/document?collection=News&id=urn:contentItem:5SNR-ST61-DYN6-W363-00000-00&context=1516831,The Associated Press (same day),"Central African Republic,Democratic Republic of the Congo,Federal Republic of Nigeria,Kingdom of Saudi Arabia,Republic of Iraq,Republic of Yemen,Somalia,South Sudan,Syrian Arab Republic,Union of Burma,United Arab Emirates,United States",relevant,BulkLexisNexis_v2
20180628151518701,2018-06-29T05:00:00Z,"Over 10,000 children killed, maimed in conflicts worldwide: UN - Front Page - observerbd.com",http://www.observerbd.com:80/details.php?id=145223,,"Central African Republic,Democratic Republic of the Congo,Federal Republic of Nigeria,Kingdom of Saudi Arabia,Republic of Iraq,Republic of Yemen,Somalia,South Sudan,Syrian Arab Republic,Union of Burma,United Arab Emirates",relevant,Web
20180627234906784,2018-06-28T15:44:24Z,"10,000 children killed, maimed in conflicts worldwide: UN   
 - International - observerbd.com",http://www.observerbd.com:80/details.php?id=145064,,"Central African Republic,Democratic Republic of the Congo,Federal Republic of Nigeria,Kingdom of Saudi Arabia,Republic of Iraq,Republic of Yemen,Somalia,South Sudan,Syrian Arab Republic,Union of Burma,United Arab Emirates,United States",relevant,Web
20220113202159559,2018-06-28T05:00:00Z,"UN: 10,000 children killed, maimed in conflicts worldwide",,Associated Press International,"Central African Republic,Democratic Republic of the Congo,Federal Republic of Nigeria,Kingdom of Saudi Arabia,Republic of Iraq,Republic of Yemen,Somalia,South Sudan,Syrian Arab Republic,Union of Burma,United Arab Emirates,United States",relevant,BulkLexisNexis_v2
20220113202150186,2018-06-28T05:00:00Z,"UN: 10,000 children killed, maimed in conflicts worldwide",,Associated Press International,"Central African Republic,Democratic Republic of the Congo,Federal Republic of Nigeria,Kingdom of Saudi Arabia,Republic of Iraq,Republic of Yemen,Somalia,South Sudan,Syrian Arab Republic,Union of Burma,United Arab Emirates,United States",relevant,BulkLexisNexis_v2
20180706205027968,2018-07-04T01:30:17Z,Deported from the US to a Somali danger zone - BBC News,https://www.bbc.co.uk:443/news/world-africa-44551333,,"Gambia,Republic of Kenya,Republic of Senegal,Somalia",relevant,Web
20180703232339333,2018-07-04T01:30:17Z,How US-Somalis are deported 'to a foreign land' - BBC News,https://www.bbc.co.uk:443/news/world-africa-44551333,,"Gambia,Republic of Kenya,Republic of Senegal,Somalia",relevant,Web
20180806033900294,2018-08-06T08:12:00Z,When al-Qaida brought terror to East Africa | Africa | DW | 06.08.2018,http://www.dw.com:80/en/when-al-qaida-brought-terror-to-east-africa/a-44961662?maca=en-rss-en-all-1573-rdf,,"Islamic Republic of Iran,Republic of Iraq,Republic of Kenya,Republic of Mali,Russian Federation,Somalia,Syrian Arab Republic,United Republic of Tanzania,United States",relevant,Web
20180601190121126,2018-06-01T23:47:56Z,How Mozambique’s smuggling barons nurtured jihadists - BBC News,https://www.bbc.co.uk:443/news/world-africa-44320531,,"Republic of Kenya,Republic of Mozambique,Republic of South Africa,Somalia,United Republic of Tanzania",relevant,Web
20180715112120450,2018-07-15T15:00:00Z,"Tell Us 5 Things About Your Book: A Refugee Says, ‘Call Me American’ - The New York Times",https://www.nytimes.com:443/2018/07/15/books/call-me-american-abdi-nor-iftin-interview.html?partner=rss&emc=rss,,"Republic of Kenya,Somalia,United States",relevant,Web
20181217013835465,2018-07-15T05:00:00Z,"Tell Us 5 Things About Your Book: A Refugee Says, ‘Call Me American’Q. & A.",https://advance.lexis.com/api/document?collection=News&id=urn:contentItem:5STC-9691-DXY4-X17R-00000-00&context=1516831,The New York Times,"Republic of Kenya,Somalia,United States",relevant,BulkLexisNexis_v2
20181217014523372,2018-07-16T05:00:00Z,From War-Scarred Somali To Visa Lottery Winner,https://advance.lexis.com/api/document?collection=News&id=urn:contentItem:5STC-SCV1-DXY4-X223-00000-00&context=1516831,The New York Times,"Republic of Kenya,Somalia,United States",relevant,BulkLexisNexis_v2
20190225011949592,2018-07-01T17:00:00Z,A former Somali refugee warns: Trump's travel ban is creating a more perfect division ; A Rhodes Scholar writes: Policies of exclusion do not create a more perfect union; only exclusion of such policies can do that.,https://advance.lexis.com/api/document?collection=News&id=urn:contentItem:5SNT-38D1-JB4M-V33Y-00000-00&context=1516831,The Washington Post,"Republic of Kenya\, Kenya,Somalia,United States",relevant,BulkLexisNexis
20190407154015217,2018-06-21T05:00:00Z,Regional leaders renew push for elusive South Sudan peace,https://advance.lexis.com/api/document?collection=News&id=urn:contentItem:5SM8-0841-DY93-M1MP-00000-00&context=1516831,Agence France Presse - English,"Federal Democratic Republic of Ethiopia\, Ethiopia,Republic of Kenya\, Kenya,Republic of South Africa\, South Africa,Republic of the Sudan\, Sudan,Somalia,South Sudan",relevant,BulkLexisNexis
20180525055205852,2018-05-25T10:26:03Z,"Cyclone Mekunu hits Socotra island before Yemen, Oman landfall - CNN",http://rss.cnn.com:80/~r/rss/cnn_latest/~3/bOUB7FtdfRU/index.html,,"Kingdom of Saudi Arabia,Republic of Yemen,Somalia,Sultanate of Oman",relevant,Web
20180627175133800,2018-06-27T22:48:43Z,"WTOP | UN: 10,000 children killed, maimed in conflicts worldwide",https://wtop.com:443/middle-east/2018/06/us-backed-arab-countries-blamed-for-child-deaths-in-yemen/,,"Central African Republic,Democratic Republic of the Congo,Federal Republic of Nigeria,Kingdom of Saudi Arabia,Republic of Iraq,Republic of Yemen,Somalia,South Sudan,Syrian Arab Republic,Union of Burma,United Arab Emirates,United States",relevant,Web
20180627181101065,2018-06-27T23:00:08Z,Facebook icon,http://www.philly.com:80/r?19=961&43=165776&44=486721561&32=3796&7=195377&40=http%3A%2F%2Fwww.philly.com%2Fphilly%2Fnews%2Fnation_world%2F20180627_ap_e5a6cbef756f4ddcbc5602339ce16948.html,,"Central African Republic,Democratic Republic of the Congo,Federal Republic of Nigeria,Kingdom of Saudi Arabia,Republic of Iraq,Republic of Yemen,Somalia,South Sudan,Syrian Arab Republic,Union of Burma,United Arab Emirates,United States",relevant,Web
20180702170944901,2018-07-02T21:49:17Z,"Who is Halima Aden, the first model to wear a hijab on the cover of Teen Vogue? - ABC News",https://abcnews.go.com:443/GMA/Culture/halima-aden-model-wear-hijab-cover-teen-vogue/story?id=56323006,,"Republic of Kenya,Somalia,United States",relevant,Web
20180627181534735,2018-06-27T22:49:12Z,"UN: 10,000 children killed, maimed in conflicts worldwide - ABC News",https://abcnews.go.com:443/International/wireStory/us-backed-arab-countries-blamed-child-deaths-yemen-56209239,,"Central African Republic,Democratic Republic of the Congo,Federal Republic of Nigeria,Kingdom of Saudi Arabia,Republic of Iraq,Republic of Yemen,Somalia,South Sudan,Syrian Arab Republic,Union of Burma,United Arab Emirates,United States",relevant,Web
20180627143313895,2018-06-27T19:17:58Z,5 of 7 nations hit by US travel ban are majority Muslim,https://www.springfieldnewssun.com:443/news/nations-hit-travel-ban-are-majority-muslim/uPTRkyk7ULjCwkgBSqiScP/,,"Bolivarian Republic of Venezuela,Democratic People's Republic of Korea,Federal Democratic Republic of Ethiopia,Hashemite Kingdom of Jordan,Islamic Republic of Iran,Republic of Armenia,Republic of Colombia,Republic of Iraq,Republic of Korea,Republic of Singapore,Republic of Yemen,Somalia,Syrian Arab Republic,United Arab Emirates,United States",relevant,Web
20180628004438834,2018-06-28T05:32:08Z,5 of 7 nations hit by US travel ban are majority Muslim,https://www.springfieldnewssun.com:443/news/world/nations-hit-travel-ban-are-majority-muslim/6RlTyPEPovJ0tf58uWIILO/,,"Bolivarian Republic of Venezuela,Democratic People's Republic of Korea,Federal Democratic Republic of Ethiopia,Hashemite Kingdom of Jordan,Islamic Republic of Iran,Republic of Armenia,Republic of Colombia,Republic of Iraq,Republic of Korea,Republic of Singapore,Republic of Yemen,Somalia,Syrian Arab Republic,United Arab Emirates,United States",relevant,Web
20180627181912583,2018-06-27T19:17:00Z,5 of 7 nations hit by US travel ban are majority Muslim,https://www.springfieldnewssun.com:443/news/nations-hit-travel-ban-are-majority-muslim/uPTRkyk7ULjCwkgBSqiScP/,,"Bolivarian Republic of Venezuela,Democratic People's Republic of Korea,Federal Democratic Republic of Ethiopia,Hashemite Kingdom of Jordan,Islamic Republic of Iran,Republic of Armenia,Republic of Colombia,Republic of Iraq,Republic of Korea,Republic of Singapore,Republic of Yemen,Somalia,Syrian Arab Republic,United Arab Emirates,United States",relevant,Web
20180605024735809,2018-06-05T07:46:30Z,US to reduce troops in AfricaThe Sun News,http://sunnewsonline.com:80/us-to-reduce-troops-in-africa/,,"Democratic People's Republic of Korea,Federal Republic of Nigeria,Islamic Republic of Iran,People's Republic of China,Republic of Benin,Republic of Niger,Russian Federation,Somalia,United States",relevant,Web
20190201234749489,2018-05-30T05:00:00Z,BBCM Africa Watchlist for 30 May,https://advance.lexis.com/api/document?collection=News&id=urn:contentItem:5SFC-DSF1-JC8S-C1R7-00000-00&context=1516831,BBC Monitoring: International Reports,"Central African Republic,Federal Democratic Republic of Ethiopia,Federal Republic of Nigeria,Republic of Equatorial Guinea,Republic of Kenya,Republic of Madagascar,Republic of Zimbabwe,Somalia,Togolese Republic",relevant,BulkLexisNexis_v2
20190623232949811,2018-08-15T05:00:00Z,Victory offers Muslim candidate new platform to oppose Trump,https://advance.lexis.com/api/document?collection=News&id=urn:contentItem:5T20-CN61-JC65-54J9-00000-00&context=1516831,The Associated Press (same day),"Commonwealth of Australia,Somalia,United States",relevant,BulkLexisNexis_v2
20180523010715434,2018-05-23T06:00:15Z,The young Somalis recreating Mogadishu's prewar splendour | Cities | The Guardian,https://www.theguardian.com:443/cities/2018/may/23/the-young-somalis-recreating-mogadishu-pre-war-glory,,"People's Republic of China,Somalia,Switzerland,United Kingdom of Great Britain and Northern Ireland",relevant,Web
20180622110036222,2018-06-22T15:57:12Z,'Somalis + Minnesota' exhibit opens Saturday at Minnesota History Center - StarTribune.com,http://www.startribune.com:80/local/486268811.html,,"Italian Republic,Republic of France,Somalia,United States",irrelevant,Web
20180625172615645,2018-06-25T18:45:14Z,Little Sparta of the Gulf | The Indian Express,https://indianexpress.com:443/article/opinion/columns/india-uae-relations-little-sparta-of-the-gulf-5233174/,,"Hellenic Republic,Islamic Republic of Afghanistan,Islamic Republic of Iran,Kingdom of Norway,Kingdom of Saudi Arabia,Republic of Cuba,Republic of India,Republic of Kosovo,Republic of Singapore,Republic of Yemen,Somalia,State of Eritrea,State of Kuwait,State of Qatar,United Arab Emirates",relevant,Web
20180627190245022,2018-06-27T23:20:37Z,U.N. Reports Sharp Increase in Children Killed or Maimed in Conflicts - The New York Times,https://www.nytimes.com:443/2018/06/27/world/un-children-armed-conflict.html?partner=rss&emc=rss,,"Central African Republic,Democratic Republic of the Congo,Federal Republic of Nigeria,Islamic Republic of Afghanistan,Kingdom of Saudi Arabia,Palestine,Republic of Colombia,Republic of Iraq,Republic of Mali,Republic of Yemen,Republic of the Congo,Republic of the Philippines,Republic of the Sudan,Somalia,South Sudan,State of Israel,Syrian Arab Republic,Ukraine,Union of Burma,United Arab Emirates,United States",relevant,Web
20180815191336868,2018-08-15T21:12:45Z,Victory offers Minnesota Muslim candidate new platform to oppose Trump,http://www.morningjournal.com:80/general-news/20180815/victory-offers-minnesota-muslim-candidate-new-platform-to-oppose-trump,,"Commonwealth of Australia,Somalia,United States",relevant,Web
20180815142446681,2018-08-15T19:19:57Z,Victory offers Muslim candidate new platform to oppose Trump | WTOP,https://wtop.com:443/congress/2018/08/somali-american-nears-new-historic-mark-with-primary-win-2/,,"Commonwealth of Australia,Somalia,United States",relevant,Web
20181217013209673,2018-06-28T05:00:00Z,U.N. Sees Rise In Toll of War On Children,https://advance.lexis.com/api/document?collection=News&id=urn:contentItem:5SNJ-92C1-DXY4-X42V-00000-00&context=1516831,The New York Times,"Central African Republic,Democratic Republic of the Congo,Federal Republic of Nigeria,Islamic Republic of Afghanistan,Kingdom of Saudi Arabia,Palestine,Republic of Colombia,Republic of Iraq,Republic of Mali,Republic of Yemen,Republic of the Congo,Republic of the Philippines,Republic of the Sudan,Somalia,South Sudan,State of Israel,Syrian Arab Republic,Ukraine,Union of Burma,United Arab Emirates,United States",relevant,BulkLexisNexis_v2
20220113211856753,2018-08-15T05:00:00Z,Victory offers Muslim candidate new platform to oppose Trump,,Associated Press International,"Commonwealth of Australia,Somalia,United States",relevant,BulkLexisNexis_v2
20220116053102067,2018-08-15T05:00:00Z,Victory offers Muslim candidate new platform to oppose Trump,,The Associated Press State & Local Wire (same day),"Commonwealth of Australia,Somalia,United States",relevant,BulkLexisNexis_v2
20180605052431469,2018-06-05T08:56:12Z,Somali refugees turn plastic waste warriors in one of world's biggest camps | Top News | Reuters,http://feeds.reuters.com:80/~r/reuters/AFRICATopNews/~3/_dEpAn7lC6A/idAFKCN1J10Y1-OZATP,,"Republic of Kenya,Republic of Uganda,Somalia,United Republic of Tanzania",relevant,Web
20180715221505076,2018-07-15T15:00:01Z,"Tell Us 5 Things About Your Book: A Refugee Says, ‘Call Me American’ - The New York Times",https://www.nytimes.com:443/2018/07/15/books/call-me-american-abdi-nor-iftin-interview.html?partner=rss&emc=rss,,"Republic of Kenya,Somalia,United States",relevant,Web
20180809060346380,2018-08-09T11:01:07Z,Sub-Saharan Africa's forcibly displaced population hit new high in 2017 | Pew Research Center,http://www.pewresearch.org:80/fact-tank/2018/08/09/record-number-of-forcibly-displaced-people-lived-in-sub-saharan-africa-in-2017/,,"Central African Republic,Democratic Republic of the Congo,Federal Democratic Republic of Ethiopia,Federal Republic of Nigeria,Republic of Iraq,Republic of Rwanda,Republic of Uganda,Republic of Yemen,Somalia,South Sudan,State of Eritrea,Syrian Arab Republic",relevant,Web
20180807142856951,2018-08-07T14:00:00Z,premium_icon,http://feedproxy.google.com:80/~r/CoffscoastadvocatecomauNational/~3/MneX4_uEq6o/,,"Islamic Republic of Afghanistan,Republic of Iraq,Republic of the Sudan,Somalia",relevant,Web
20180528080041308,2018-05-25T21:07:15Z,"Celebrate, but also honor the fallen",http://rssfeeds.thetimesherald.com:80/~/548564222/0/porthuron/opinion~Celebrate-but-also-honor-the-fallen/,,"Hashemite Kingdom of Jordan,Islamic Republic of Afghanistan,Islamic Republic of Pakistan,Libya,Republic of Yemen,Somalia,Syrian Arab Republic,United States",relevant,Web
20190225014400767,2018-08-08T05:00:00Z,"By ending 'temporary protected status' for half a million people, Trump has probably increased illegal migration ; Here are 4 things you need to know about TPS and its consequences.",https://advance.lexis.com/api/document?collection=News&id=urn:contentItem:5T03-YHD1-DXKP-J370-00000-00&context=1516831,The Washington Post,"Federal Democratic Republic of Nepal\, Patheka\, Nepal,Republic of El Salvador\, El Salvador,Republic of Haiti\, Haiti,Republic of Honduras\, Honduras,Republic of Nicaragua\, Nicaragua,Republic of Yemen\, Yemen,Republic of the Sudan\, Sudan,Somalia,South Sudan,Syrian Arab Republic\, Syria,United States",relevant,BulkLexisNexis
20190201234949187,2018-06-04T05:00:00Z,BBCM Africa Watchlist for 4 June,https://advance.lexis.com/api/document?collection=News&id=urn:contentItem:5SGF-8P41-DYRV-34FS-00000-00&context=1516831,BBC Monitoring: International Reports,"Democratic Republic of the Congo,Federal Democratic Republic of Ethiopia,Federal Republic of Nigeria,Federative Republic of Brazil,People's Republic of China,Republic of Guinea,Republic of India,Republic of Kenya,Republic of Madagascar,Republic of South Africa,Republic of the Congo,Russian Federation,Somalia,Togolese Republic",relevant,BulkLexisNexis_v2
20180720002126391,2018-07-20T05:00:11Z,When is a nation not a nation? Somaliland’s dream of independence | News | The Guardian,https://www.theguardian.com:443/news/2018/jul/20/when-is-a-nation-not-a-nation-somalilands-dream-of-independence,,"Arab Republic of Egypt,Democratic People's Republic of Korea,Federal Democratic Republic of Ethiopia,Federal Republic of Nigeria,Federal Republic of Yugoslavia,Gambia,Italian Republic,Kingdom of Sweden,Libya,Palestine,People's Republic of China,Republic of France,Republic of India,Republic of Iraq,Republic of Senegal,Republic of Yemen,Republic of the Sudan,Russian Federation,Somalia,State of Eritrea,Syrian Arab Republic,Taiwan,Union of Soviet Socialist Republics,United Kingdom of Great Britain and Northern Ireland",relevant,Web
20180710144138095,2018-07-10T19:33:25Z,Somali students volunteer to educate the dispossessed | News24,https://www.news24.com:443/Africa/News/somali-students-volunteer-to-educate-the-dispossessed-20180710,,Somalia,irrelevant,Web
20181217013209861,2018-06-27T05:00:00Z,U.N. Reports Sharp Increase in Children Killed or Maimed in Conflicts,https://advance.lexis.com/api/document?collection=News&id=urn:contentItem:5SNH-V9J1-JBG3-6052-00000-00&context=1516831,The New York Times,"Central African Republic,Democratic Republic of the Congo,Federal Republic of Nigeria,Islamic Republic of Afghanistan,Kingdom of Saudi Arabia,Palestine,Republic of Colombia,Republic of Iraq,Republic of Mali,Republic of Yemen,Republic of the Congo,Republic of the Philippines,Republic of the Sudan,Somalia,South Sudan,State of Israel,Syrian Arab Republic,Ukraine,Union of Burma,United Arab Emirates,United States",relevant,BulkLexisNexis_v2
20180626140629481,2018-06-26T19:00:03Z,"Supreme Court travel ban ruling: Which countries, what does it do?",https://www.mydaytondailynews.com:443/news/national/supreme-court-travel-ban-ruling-which-countries-what-does-which-justices-voted-for/xHo3Cg8E0f1MLzxiCIVfBL/,,"Bolivarian Republic of Venezuela,Democratic People's Republic of Korea,Islamic Republic of Iran,Kingdom of Saudi Arabia,Libya,Republic of Chad,Republic of Yemen,Somalia,Sultanate of Oman,Syrian Arab Republic,United States",relevant,Web
20180807221420476,2018-08-08T02:56:00Z,The West Australian,https://thewest.com.au:443/entertainment/tv/amanda-lindhout-recounts-15-month-somalia-ordeal-on-andrew-denton-interview-ng-7aa1ccb6a54b4564e6b885793c549309,,"Islamic Republic of Afghanistan,Republic of Iraq,Somalia",relevant,Web
20180601042728347,2018-06-01T09:00:00Z,"Syrian aid worker has full scholarship to Johns Hopkins, but worries he can't get a visa - Baltimore Sun",http://www.baltimoresun.com:80/news/maryland/bs-hs-syria-student-20180511-story.html,,"Islamic Republic of Iran,Libya,People's Republic of China,Republic of Chad,Republic of Yemen,Somalia,Syrian Arab Republic,United States",relevant,Web
20190407154253527,2018-06-29T05:00:00Z,"Free trade, crises in spotlight as AU leaders meet",https://advance.lexis.com/api/document?collection=News&id=urn:contentItem:5SNY-RNV1-DY93-M0JY-00000-00&context=1516831,Agence France Presse - English,"Burkina Faso,Democratic Republic of the Congo,Federal Democratic Republic of Ethiopia\, Ethiopia,Federal Republic of Nigeria\, Nigeria,Hellenic Republic\, Greece,Hungary,Islamic Republic of Mauritania\, Mauritania,Repubblica Italiana\, Italy,Republic of Botswana\, Botswana,Republic of Cabo Verde\, Cape Verde,Republic of Chad\, Chad,Republic of Mali\, Mali,Republic of Namibia\, Namibia,Republic of Niger\, Niger,Republic of Rwanda\, Rwanda,Republic of Seychelles\, Seychelles,Republic of South Africa\, South Africa,Somalia,South Sudan,State of Eritrea\, Eritrea",relevant,BulkLexisNexis
20180622015758716,2018-06-22T06:00:00Z,Former refugees visit Naracoorte schools to share stories | Naracoorte Herald,http://www.naracoorteherald.com.au:80/story/5482086/former-refugees-visit-naracoorte-schools-to-share-stories/?src=rss,,"Commonwealth of Australia,Federal Democratic Republic of Ethiopia,Kingdom of Cambodia,Republic of Iraq,Republic of Kenya,Somalia",relevant,Web
20180607001006409,2018-06-07T05:08:47Z,"Trump hosts first iftar dinner at WH, seeks co-operation from Muslim world – State Times",http://news.statetimes.in:80/trump-hosts-first-iftar-dinner-at-wh-seeks-co-operation-from-muslim-world/,,"Arab Republic of Egypt,Bosnia and Herzegovina,Federal Democratic Republic of Ethiopia,Gambia,Islamic Republic of Iran,Kingdom of Bahrain,Kingdom of Morocco,Libya,People's Democratic Republic of Algeria,Republic of Iraq,Republic of Tunisia,Republic of Yemen,Somalia,State of Kuwait,State of Qatar,Syrian Arab Republic,United Arab Emirates",relevant,Web
20180629004214500,2018-06-29T04:41:19Z,"Free trade, crises in spotlight as AU leaders meet",http://www.thesundaily.my:80/news/2018/06/29/free-trade-crises-spotlight-au-leaders-meet,,"Burkina Faso,Federal Democratic Republic of Ethiopia,Federal Republic of Nigeria,Hellenic Republic,Hungary,Islamic Republic of Mauritania,Italian Republic,Republic of Botswana,Republic of Cabo Verde,Republic of Chad,Republic of Mali,Republic of Namibia,Republic of Niger,Republic of Rwanda,Republic of Seychelles,Republic of South Africa,Republic of the Sudan,Somalia,South Sudan,State of Eritrea",relevant,Web
20180728033619982,2018-07-28T08:33:10Z,Guest column: U.S. cannot wash its hands of the refugee crises | Post Register,http://www.postregister.com:80/articles/opinions/2018/07/28/guest-column-us-cannot-wash-its-hands-refugee-crises,,"Libya,Republic of Iraq,Republic of Yemen,Socialist Republic of Vietnam,Somalia,Syrian Arab Republic,United Arab Emirates,United States",relevant,Web
20180527055625897,2018-05-27T10:39:37Z,Changing the African narrative through social media platforms - Opinion/Editorial | The Citizen,http://www.thecitizen.co.tz:80/oped/Changing-the-African-narrative-through-social-media-platforms/1840568-4582266-l5lk2az/index.html,,"Somalia,United Republic of Tanzania",relevant,Web
20180606160135527,2018-06-06T20:51:49Z,Nation's 1st Somali-American lawmaker eyes seat in Congress - seattlepi.com,https://www.seattlepi.com:443/news/politics/article/Nation-s-1st-Somali-American-lawmaker-eyes-seat-12973315.php,,"Republic of Kenya,Somalia,United States",relevant,Web
20180727211054221,2018-07-27T14:14:00Z,Mali′s president to face 23 contenders in July 29 vote | Africa | DW | 27.07.2018,http://www.dw.com:80/en/mali-s-president-to-face-23-contenders-in-july-29-vote/a-44849726?maca=en-rss-en-world-4025-rdf,,"Democratic Republic of the Congo,Federal Democratic Republic of Ethiopia,Federal Republic of Germany,Federal Republic of Nigeria,Kingdom of Morocco,Republic of Burundi,Republic of Cote d'Ivoire,Republic of Djibouti,Republic of France,Republic of Ghana,Republic of Kenya,Republic of Liberia,Republic of Mali,Republic of Sierra Leone,Republic of Uganda,Republic of the Congo,Republic of the Sudan,Somalia,South Sudan,Western Sahara",relevant,Web
20180815025556003,2018-08-15T08:42:07Z,Copy,https://www.buzzfeednews.com:443/article/talalansari/the-first-somali-american-state-lawmaker-in-the-us-is-on,,"Republic of Kenya,Somalia,United States",relevant,Web
20190623231126708,2018-06-27T05:00:00Z,Supreme Court's nod to travel ban heightens refugee worries,https://advance.lexis.com/api/document?collection=News&id=urn:contentItem:5SNH-TMB1-DYN6-W0WC-00000-00&context=1516831,The Associated Press (same day),"Democratic People's Republic of Korea,Hashemite Kingdom of Jordan,Islamic Republic of Iran,Lebanon,Libya,Republic of Yemen,Somalia,Syrian Arab Republic,United States",relevant,BulkLexisNexis_v2
