aid,publication_date,title,url,publisher,country,status,source_name
20180603045214439,2018-06-03T08:00:00Z,"Syrian aid worker has full scholarship to Johns Hopkins, but worries he can't get a visa | Columbus Ledger-Enquirer",http://www.ledger-enquirer.com:80/news/nation-world/national/article212438824.html,,"Bolivarian Republic of Venezuela,Islamic Republic of Iran,Libya,People's Republic of China,Republic of Chad,Republic of Yemen,Somalia,Syrian Arab Republic,United States",relevant,Web
20180603045358215,2018-06-03T08:00:00Z,"Syrian aid worker has full scholarship to Johns Hopkins, but worries he can't get a visa | Fort Worth Star-Telegram",http://www.star-telegram.com:80/news/nation-world/national/article212438824.html,,"Bolivarian Republic of Venezuela,Islamic Republic of Iran,Libya,People's Republic of China,Republic of Chad,Republic of Yemen,Somalia,Syrian Arab Republic,United States",relevant,Web
20180603045123321,2018-06-03T08:00:00Z,"Syrian aid worker has full scholarship to Johns Hopkins, but worries he can't get a visa | The News Tribune",http://www.thenewstribune.com:80/news/nation-world/national/article212438824.html,,"Bolivarian Republic of Venezuela,Islamic Republic of Iran,Libya,People's Republic of China,Republic of Chad,Republic of Yemen,Somalia,Syrian Arab Republic,United States",relevant,Web
20180701140925863,2018-07-02T05:00:00Z,War against civilians: The US in Libya and Yemen - Op-Ed - observerbd.com,http://www.observerbd.com:80/details.php?id=145732,,"Democratic People's Republic of Korea,Islamic Republic of Iran,Islamic Republic of Pakistan,Italian Republic,Kingdom of Saudi Arabia,Libya,People's Republic of China,Republic of Iraq,Republic of Yemen,Russian Federation,Somalia,State of Israel,Syrian Arab Republic,United Arab Emirates,United Kingdom of Great Britain and Northern Ireland,United States",relevant,Web
20190202001424285,2018-08-07T05:00:00Z,BBCM Africa Watchlist for 7 August,https://advance.lexis.com/api/document?collection=News&id=urn:contentItem:5T03-DG71-DYRV-33X9-00000-00&context=1516831,BBC Monitoring: International Reports,"Democratic Republic of the Congo,Federal Democratic Republic of Ethiopia,Gabonese Republic,Republic of Cameroon,Republic of Chad,Republic of Kenya,Republic of South Africa,Republic of Zimbabwe,Republic of the Congo,Republic of the Sudan,Somalia,United Republic of Tanzania",relevant,BulkLexisNexis_v2
20180624032939607,2018-06-24T08:00:20Z,"Born out of brutality, South Sudan, the world’s youngest state, drowns in murder, rape and arson | Global development | The Guardian",https://www.theguardian.com:443/global-development/2018/jun/24/south-sudan-civil-war-refugees-families-flee-murder-rape-arson-nyal-global-development,,"Federal Democratic Republic of Ethiopia,Islamic Republic of Afghanistan,Republic of Kenya,Republic of Uganda,Republic of the Sudan,Somalia,South Sudan,Syrian Arab Republic",relevant,Web
20180606221113904,2018-06-07T01:13:00Z,'Ramadan Mubarak': Trump hosts first iftar dinner,http://www.dailyherald.com:80/article/20180606/news/306069827/,,"Democratic People's Republic of Korea,Hashemite Kingdom of Jordan,Islamic Republic of Iran,Kingdom of Saudi Arabia,Libya,Republic of Yemen,Somalia,State of Israel,State of Kuwait,Syrian Arab Republic,United Arab Emirates,United Kingdom of Great Britain and Northern Ireland,United States",relevant,Web
20180623081946972,2018-06-23T13:04:51Z,Ethiopian prime minister vows to stick to reforms after explosion at rally | World news | The Guardian,https://www.theguardian.com:443/world/2018/jun/23/explosion-rally-new-ethiopian-prime-minister-abiy-ahmed,,"Federal Democratic Republic of Ethiopia,Somalia,State of Eritrea,Union of Soviet Socialist Republics",relevant,Web
20180623122945000,2018-06-23T17:06:11Z,Ethiopian prime minister vows to stick to reforms after explosion at rally | World news | The Guardian,https://www.theguardian.com:443/world/2018/jun/23/explosion-rally-new-ethiopian-prime-minister-abiy-ahmed,,"Federal Democratic Republic of Ethiopia,Republic of South Africa,Somalia,State of Eritrea,Union of Soviet Socialist Republics",relevant,Web
20180627115602282,2018-06-27T13:10:29Z,Supreme Court's nod to travel ban heightens refugee worries - Nation/World - The Daily Astorian,http://www.dailyastorian.com:80/supreme-courts-nod-to-travel-ban-heightens-refugee-worries-da-ap-webfeeds-news-nation-worldebab34a2ef1447bdb645980022f378de,,"Democratic People's Republic of Korea,Hashemite Kingdom of Jordan,Islamic Republic of Iran,Lebanon,Libya,Republic of Yemen,Somalia,Syrian Arab Republic,United States",relevant,Web
20180810162734370,2018-08-10T21:19:31Z,Appeals court upholds sentences for three Twin Cities men in ISIS case - StarTribune.com,http://www.startribune.com:80/local/490564711.html,,"Republic of Iraq,Somalia,Syrian Arab Republic,United States",relevant,Web
20180616090232646,2018-06-16T14:00:00Z,Curious link between world peace and gender equality,https://www.smh.com.au:443/world/asia/curious-link-between-world-peace-and-gender-equality-20180615-p4zlth.html?utm_medium=rss&utm_source=rss_feed,,"Commonwealth of Australia,Democratic People's Republic of Korea,Independent State of Papua New Guinea,Islamic Republic of Afghanistan,Japan,Kingdom of Denmark,Kingdom of Norway,Kingdom of Sweden,New Zealand,People's Republic of China,Portuguese Republic,Republic of Austria,Republic of Iceland,Republic of Iraq,Republic of Korea,Republic of Singapore,Republic of South Africa,Republic of Yemen,Russian Federation,Somalia,Syrian Arab Republic,Union of Burma",relevant,Web
20180728234447259,2018-07-28T01:33:48Z,"Salty Diet Reduces Thirst, Increases Hunger | NewsGram",https://www.newsgram.com:443/salty-diet-reduces-thirst-increases-hunger/,,"Central African Republic,Federal Republic of Germany,Federal Republic of Nigeria,Federative Republic of Brazil,People's Republic of China,Republic of Azerbaijan,Republic of Chad,Republic of Iraq,Republic of Madagascar,Republic of Niger,Republic of Panama,Republic of Peru,Republic of Senegal,Republic of Sierra Leone,Republic of Yemen,Republic of Zambia,Republic of the Sudan,Somalia,Syrian Arab Republic",irrelevant,Web
20180627035825518,2018-06-27T08:23:30Z,What it's like in the 7 countries on Trump's travel ban list - CNNPolitics,http://rss.cnn.com:80/~r/rss/cnn_latest/~3/9vogn48Lh7M/index.html,,"Bolivarian Republic of Venezuela,Democratic People's Republic of Korea,Islamic Republic of Iran,Kingdom of Saudi Arabia,Libya,Republic of Korea,Republic of Singapore,Republic of Yemen,Russian Federation,Somalia,Syrian Arab Republic,United States",relevant,Web
20180526005001321,2018-05-26T05:01:00Z,Scraps of refugee life jackets turned into bracelets - Washington Times,http://www.washingtontimes.com:80/news/2018/may/26/scraps-of-refugee-life-jackets-turned-into-bracele/?utm_source=RSS_Feed&utm_medium=RSS,,"Kingdom of the Netherlands,Republic of Iraq,Republic of Kenya,Somalia,Syrian Arab Republic,United States",relevant,Web
20180621171806358,2018-06-21T22:02:45Z,A new dawn beckons for Zimbabwe | The Chronicle,http://www.chronicle.co.zw:80/a-new-dawn-beckons-for-zimbabwe/,,"Democratic Republic of the Congo,Federal Republic of Nigeria,Republic of Zimbabwe,Republic of the Congo,Somalia",relevant,Web
20180629105026520,2018-06-29T13:30:00Z,Why has China invited African army chiefs to Beijing?,https://chinapost.nownews.com:443/20180629-367212,,"Arab Republic of Egypt,Bangladesh,Democratic Republic of the Congo,Federal Democratic Republic of Ethiopia,Islamic Republic of Pakistan,Italian Republic,Japan,Kingdom of Morocco,People's Democratic Republic of Algeria,People's Republic of China,Republic of Cote d'Ivoire,Republic of Djibouti,Republic of France,Republic of India,Republic of the Congo,Republic of the Sudan,Russian Federation,Somalia",relevant,Web
20180714013340204,2018-07-14T06:31:12Z,Suicide blast kills 128 at Pakistan election rally - Japan Today,https://japantoday.com:443/category/world/Suicide-blast-kills-128-at-Pakistan-election-rally,,"Democratic Republic of the Congo,Ireland,Islamic Republic of Afghanistan,Islamic Republic of Iran,Islamic Republic of Pakistan,Japan,Libya,Palestine,Republic of the Congo,Somalia,Western Sahara",relevant,Web
20180810204428147,2018-08-11T01:35:53Z,Appeals court upholds sentences for three Twin Cities men in ISIS case - StarTribune.com,http://www.startribune.com:80/local/490564711.html,,"Somalia,Syrian Arab Republic,United States",relevant,Web
20180810194100082,2018-08-11T00:35:11Z,Appeals court upholds sentences for three Twin Cities men in ISIS case - StarTribune.com,http://www.startribune.com:80/local/490564711.html,,"Somalia,Syrian Arab Republic,United States",relevant,Web
20180807062211221,2018-08-07T11:00:28Z,"By ending ‘temporary protected status’ for half a million people, Trump has probably increased illegal migration - The Washington Post",https://www.washingtonpost.com:443/news/monkey-cage/wp/2018/08/07/by-ending-temporary-protected-status-for-half-a-million-people-trump-has-probably-increased-illegal-migration/,,"Federal Democratic Republic of Nepal,Federal Republic of Germany,Republic of El Salvador,Republic of Haiti,Republic of Honduras,Republic of Nicaragua,Republic of Yemen,Republic of the Sudan,Somalia,South Sudan,Syrian Arab Republic,United States",relevant,Web
20180601112937547,2018-06-01T15:28:36Z,World Football Cup an alternative to Fifa and a lesson in geopolitics | Football | The Guardian,https://www.theguardian.com:443/football/2018/jun/01/world-football-cup-alternative-fifa-lesson-geopolitics,,"Czechoslovakia,Democratic Socialist Republic of Sri Lanka,Federal Republic of Germany,Georgia,Hellenic Republic,Hungary,Isle of Man,Italian Republic,Japan,Kingdom of the Netherlands,People's Republic of China,Republic of Cyprus,Russian Federation,Somalia,Tuvalu,Ukraine,United Kingdom of Great Britain and Northern Ireland,United States,Western Sahara",relevant,Web
20180627061157463,2018-06-27T11:03:07Z,The AU at 55yrs: The sad truth and the way forward - Political Reforms | The Citizen,http://www.thecitizen.co.tz:80/magazine/politicalreforms/1843776-4634022-ex050x/index.html,,"Arab Republic of Egypt,Federal Democratic Republic of Ethiopia,Federal Republic of Nigeria,Kingdom of Morocco,Libya,People's Democratic Republic of Algeria,Republic of Ghana,Republic of Kenya,Republic of Liberia,Republic of Mali,Republic of Sierra Leone,Republic of South Africa,Republic of Zimbabwe,Russian Federation,Somalia,United Kingdom of Great Britain and Northern Ireland,United Republic of Tanzania,United States",relevant,Web
20180620195221414,2018-06-21T00:40:06Z,Celebrating World Refugee Day | TheSpec.com,https://www.thespec.com:443/news-story/8685184-celebrating-world-refugee-day/,,"Federal Democratic Republic of Ethiopia,Federal Republic of Germany,Hashemite Kingdom of Jordan,Islamic Republic of Afghanistan,Italian Republic,Kingdom of Norway,Libya,Mexico,Palestine,Republic of El Salvador,Republic of Guatemala,Republic of Iraq,Republic of the Sudan,Somalia,State of Eritrea,Syrian Arab Republic,United States",relevant,Web
20180608112227708,2018-06-08T16:11:59Z,TEDxKakumaCamp: Kenya's Kakuma camp will host world's TEDx in a refugee camp - CNN,http://rss.cnn.com:80/~r/rss/cnn_latest/~3/yYA1D93jDSU/index.html,,"Democratic Republic of the Congo,Federal Democratic Republic of Ethiopia,Federal Republic of Germany,Federative Republic of Brazil,Grand Duchy of Luxembourg,Islamic Republic of Iran,Kingdom of Belgium,People's Republic of China,Republic of Kenya,Republic of Rwanda,Republic of Uganda,Republic of the Sudan,Somalia,South Sudan,State of Eritrea,Syrian Arab Republic",relevant,Web
20180615085136886,2018-06-15T10:00:03Z,Donald Trump's Muslim ban could have cost my wife her life,http://rssfeeds.usatoday.com:80/~/552344596/0/news-opinion~I-help-save-American-lives-but-Donald-Trumpaposs-travel-ban-could-have-cost-my-wife-her-life/,,"Bolivarian Republic of Venezuela,Democratic People's Republic of Korea,Islamic Republic of Iran,Libya,Republic of Chad,Republic of Djibouti,Republic of Yemen,Somalia,Syrian Arab Republic,United States",relevant,Web
20180626233339461,2018-06-27T03:05:30Z,"Area Muslims react to Supreme Court decision upholding Trump's travel ban - News - telegram.com - Worcester, MA",http://www.telegram.com:80/news/20180626/area-muslims-react-to-supreme-court-decision-upholding-trumps-travel-ban?rssfeed=true,,"Islamic Republic of Iran,Libya,Mexico,Republic of Yemen,Somalia,Syrian Arab Republic,United States",relevant,Web
20180626110321210,2018-06-26T14:32:51Z,U.S. Supreme Court rules in Trump's favour on travel ban | CBC News,https://www.cbc.ca:443/news/world/us-supreme-court-ruling-trump-travel-1.4722234?cmp=rss,,"Bolivarian Republic of Venezuela,Democratic People's Republic of Korea,Islamic Republic of Iran,Libya,Republic of Chad,Republic of Iraq,Republic of Yemen,Republic of the Sudan,Somalia,Syrian Arab Republic,United States",relevant,Web
20190202001012920,2018-07-26T05:00:00Z,BBCM Africa Watchlist for 26 July,https://advance.lexis.com/api/document?collection=News&id=urn:contentItem:5SWH-S9J1-JC8S-C2F7-00000-00&context=1516831,BBC Monitoring: International Reports,"Democratic Republic of the Congo,Federal Democratic Republic of Ethiopia,Federal Republic of Nigeria,Federative Republic of Brazil,People's Republic of China,Republic of Cameroon,Republic of India,Republic of South Africa,Republic of Uganda,Republic of Zimbabwe,Republic of the Congo,Republic of the Sudan,Russian Federation,Somalia",relevant,BulkLexisNexis_v2
20190201235852343,2018-06-26T05:00:00Z,BBCM Africa Watchlict for 26 June,https://advance.lexis.com/api/document?collection=News&id=urn:contentItem:5SN4-MTB1-DYRV-33BJ-00000-00&context=1516831,BBC Monitoring: International Reports,"Democratic Republic of the Congo,Federal Democratic Republic of Ethiopia,Federal Republic of Nigeria,Islamic Republic of Iran,Kingdom of Morocco,Kingdom of Spain,Portuguese Republic,Republic of Cote d'Ivoire,Republic of Kenya,Republic of South Africa,Republic of Zimbabwe,Republic of the Congo,Republic of the Sudan,Somalia,State of Eritrea",relevant,BulkLexisNexis_v2
20190201235121248,2018-06-08T05:00:00Z,BBCM Africa Watchlist for 8 June,https://advance.lexis.com/api/document?collection=News&id=urn:contentItem:5SHB-0CM1-DYRV-32DB-00000-00&context=1516831,BBC Monitoring: International Reports,"Central African Republic,Democratic Republic of the Congo,Federal Democratic Republic of Ethiopia,Federal Republic of Nigeria,Libya,Republic of Burundi,Republic of Chad,Republic of Ghana,Republic of Kenya,Republic of Madagascar,Republic of Mali,Republic of Mozambique,Republic of South Africa,Republic of Uganda,Republic of the Congo,Republic of the Sudan,Russian Federation,Somalia,State of Eritrea,Togolese Republic,Union of the Comoros",relevant,BulkLexisNexis_v2
20180623214938105,2018-06-24T02:48:44Z,"Pageant promoter demanded my nude pictures –Fahima Kullow, Somalian beauty queen - The Sun NewsThe Sun News",http://sunnewsonline.com:80/pageant-promoter-demanded-my-nude-pictures-fahima-kullow-somalian-beauty-queen/,,"Federal Republic of Nigeria,People's Republic of China,Portuguese Republic,Republic of Croatia,Republic of France,Republic of Iceland,Republic of Kenya,Russian Federation,Somalia",relevant,Web
20180706232957536,2018-06-29T23:06:18Z,"Trump May Deport 1,200 People To Yemen As The U.S. Bombs The Country | HuffPost",https://www.huffingtonpost.com:443/entry/trump-deport-yemen-us-bombs_us_5b36693ee4b007aa2f7fab19,,"Islamic Republic of Iran,Republic of Yemen,Somalia,Syrian Arab Republic,United States",relevant,Web
20180711113701436,2018-07-11T14:54:49Z,"In Egypt, softly-softly approach helps integrate Syrian refugees | Arab News",http://www.arabnews.com:80/node/1337186/middle-east,,"Arab Republic of Egypt,Federal Republic of Germany,Hashemite Kingdom of Jordan,Islamic Republic of Iran,Kingdom of Morocco,Lebanon,Libya,Palestine,People's Democratic Republic of Algeria,Republic of Iraq,Republic of Niger,Republic of Tunisia,Republic of Yemen,Republic of the Sudan,Russian Federation,Somalia,State of Israel,Syrian Arab Republic",relevant,Web
20180728005714224,2018-06-29T23:06:18Z,"Trump May Deport 1,200 People To Yemen As The U.S. Bombs The Country | HuffPost",https://www.huffingtonpost.com:443/entry/trump-deport-yemen-us-bombs_us_5b36693ee4b007aa2f7fab19,,"Islamic Republic of Iran,Republic of Yemen,Somalia,Syrian Arab Republic,United States",relevant,Web
20180728081030291,2018-07-28T13:02:29Z,"Syrian refugees in Chicago grateful, tearful, tense | The Columbian",https://www.columbian.com:443/news/2018/jul/28/syrian-refugees-in-chicago-grateful-tearful-tense/,,"Democratic People's Republic of Korea,Islamic Republic of Iran,Libya,Republic of Yemen,Somalia,Syrian Arab Republic,United States",relevant,Web
20180817151705408,2018-06-29T23:06:18Z,"Trump May Deport 1,200 People To Yemen As The U.S. Bombs The Country | HuffPost",https://www.huffingtonpost.com:443/entry/trump-deport-yemen-us-bombs_us_5b36693ee4b007aa2f7fab19,,"Islamic Republic of Iran,Republic of Yemen,Somalia,Syrian Arab Republic,United States",relevant,Web
20180630114108418,2018-06-30T16:40:29Z,This Day in History (July 1),http://kayhan.ir:80/en/news/54571/this-day-in-history-july-1,,"Arab Republic of Egypt,Burkina Faso,Democratic People's Republic of Korea,Federal Democratic Republic of Ethiopia,Federal Republic of Germany,Grenada,Hellenic Republic,Hong Kong Special Administrative Region,Islamic Republic of Iran,Islamic Republic of Pakistan,Kingdom of Bahrain,Kingdom of Belgium,People's Democratic Republic of Algeria,People's Republic of China,Republic of Burundi,Republic of Cote d'Ivoire,Republic of Djibouti,Republic of France,Republic of Ghana,Republic of India,Republic of Iraq,Republic of Kenya,Republic of Rwanda,Republic of Yemen,Russian Federation,Somalia,Syrian Arab Republic,Togolese Republic,United Kingdom of Great Britain and Northern Ireland,United States",relevant,Web
20180527201059921,2018-05-27T19:39:47Z,Nothing 'unconscious' about racial profiling,https://www.radionz.co.nz:443/national/programmes/voices/audio/2018646720/nothing-unconscious-about-racial-profiling,,"New Zealand,Republic of South Africa,Somalia",relevant,Web
20180602230950140,2018-06-03T04:00:00Z,"Jim Brooks, Dayton Daily News",https://www.mydaytondailynews.com:443/news/opinion/commentary-you-may-imprison-the-body-but-not-the-mind/vjZbfXApvFLeBBg5GwsZ7I/,,"Georgia,Republic of Korea,Somalia",relevant,Web
20180608105825201,2018-06-08T15:40:46Z,"IRIN | More migrant disasters, less help for Yemenis, and Cameroon’s brewing war: The Cheat Sheet",http://www.irinnews.org:80/news/2018/06/08/more-migrant-disasters-less-help-yemenis-and-cameroon-s-brewing-war-cheat-sheet,,"Bolivarian Republic of Venezuela,Federal Republic of Germany,Federal Republic of Nigeria,Islamic Republic of Afghanistan,Kingdom of Denmark,Kingdom of Norway,Kingdom of the Netherlands,Libya,North Macedonia,Republic of Albania,Republic of Austria,Republic of Cameroon,Republic of Chad,Republic of Colombia,Republic of Djibouti,Republic of France,Republic of Iraq,Republic of Niger,Republic of Tunisia,Republic of Yemen,Somalia,Switzerland,Syrian Arab Republic",relevant,Web
20180616122228742,2018-06-16T16:59:02Z,"Finsbury Park victim: ‘Terror ruined everything. My family, my job, my life’ | UK news | The Guardian",https://www.theguardian.com:443/uk-news/2018/jun/16/drudgery-of-pain-finsbury-park-mosque-terror-attack-one-year-on-victim-shariff-xamza,,"Somalia,United Kingdom of Great Britain and Northern Ireland",relevant,Web
20190225013752317,2018-07-27T05:00:00Z,'It gives you a name',https://advance.lexis.com/api/document?collection=News&id=urn:contentItem:5SW9-87F1-JCDY-T4P3-00000-00&context=1516831,The Washington Post,"Republic of Kenya\, Kenya,Somalia,United States",relevant,BulkLexisNexis
20190225013444053,2018-07-27T05:00:00Z,'It gives you a name',https://advance.lexis.com/api/document?collection=News&id=urn:contentItem:5SW9-DBH1-JBFW-C4JN-00000-00&context=1516831,The Washington Post,"Republic of Kenya\, Kenya,Somalia,United States",relevant,BulkLexisNexis
20180601131949493,2018-06-01T17:47:12Z,"127 dead and 9,000 arrested in Duterte-style drug crackdown in Bangladesh | CBC News",http://www.cbc.ca:80/news/thenational/national-today-newsletter-bangladesh-drugs-japan-1.4683599?cmp=rss,,"Antarctica,Bangladesh,Federal Republic of Germany,Italian Republic,Japan,Malaysia,Republic of Kenya,Republic of the Philippines,Somalia,Syrian Arab Republic,Union of Burma,United States",relevant,Web
20180801100610261,2018-08-01T15:02:25Z,Rising to leadership: How second-generation Somali-Americans are coming into their own in Minnesota | MinnPost,https://www.minnpost.com:443/new-americans/2018/08/rising-leadership-how-second-generation-somali-americans-are-coming-their-own-,,"Federal Democratic Republic of Ethiopia,Islamic Republic of Pakistan,Kingdom of Denmark,Kingdom of Norway,Kingdom of Sweden,Socialist Republic of Vietnam,Somalia,United States",relevant,Web
20180817113855063,2018-08-15T20:07:27Z,‘Journey for Justice’ Caravan Launches Cross-Country Trek – Consortiumnews,https://consortiumnews.com:443/2018/08/15/journey-for-justice-caravan-launches-cross-country-trek/,,"Federal Democratic Republic of Nepal,Libya,People's Republic of China,Republic of El Salvador,Republic of Guatemala,Republic of Haiti,Republic of Honduras,Republic of Nicaragua,Republic of Yemen,Republic of the Sudan,Somalia,Syrian Arab Republic,United States",relevant,Web
20190225010201686,2018-06-06T17:00:00Z,"At this school, being 'different' is an asset ; Denver South High School is being honored in the Schools of Opportunity project. Here's why.",https://advance.lexis.com/api/document?collection=News&id=urn:contentItem:5SGR-3NX1-JB4M-V0YF-00000-00&context=1516831,The Washington Post,"Republic of Colombia\, Colombia,Republic of El Salvador\, El Salvador,Republic of Iraq\, Iraq,Somalia,State of Eritrea\, Eritrea,Syrian Arab Republic\, Syria,Ukraine,United States",irrelevant,BulkLexisNexis
20180606211650707,2018-06-06T17:40:09Z,'Ramadan Mubarak': Trump hosts first iftar dinner,https://www.springfieldnewssun.com:443/news/national-govt--politics/ramadan-mubarak-trump-hosts-first-iftar-dinner/04pq7PP35Yg9K04oDTIupN/,,"Democratic People's Republic of Korea,Hashemite Kingdom of Jordan,Islamic Republic of Iran,Kingdom of Saudi Arabia,Libya,Republic of Yemen,Somalia,State of Israel,State of Kuwait,Syrian Arab Republic,United Arab Emirates,United Kingdom of Great Britain and Northern Ireland,United States",relevant,Web
20180627111248513,2018-06-27T12:08:37Z,Supreme Court's nod to travel ban heightens refugee worries,https://www.springfieldnewssun.com:443/news/world/supreme-court-nod-travel-ban-heightens-refugee-worries/kC71bStrAU1JFRh7sEpS5O/,,"Democratic People's Republic of Korea,Georgia,Hashemite Kingdom of Jordan,Islamic Republic of Iran,Lebanon,Libya,Republic of Yemen,Somalia,Syrian Arab Republic,United States",relevant,Web
20220115014110717,2018-05-21T05:00:00Z,CAN PREVENTIVE DIPLOMACY AVERT MILITARY CONFLICTS?,,Inter Press Service,"Central African Republic,Republic of India,Republic of Kenya,Republic of Sierra Leone,Somalia",relevant,BulkLexisNexis_v2
20180809235006528,2018-08-09T22:25:00Z,What Led To New York City's Legislation To Cap The Number Of Ride-Hailing Vehicles | WMUK,http://www.wmuk.org:80/post/what-led-new-york-citys-legislation-cap-number-ride-hailing-vehicles,,"Bolivarian Republic of Venezuela,Democratic People's Republic of Korea,Islamic Republic of Iran,Libya,Republic of Djibouti,Republic of Yemen,Somalia,Syrian Arab Republic,United States",relevant,Web
20180516043909619,2018-05-16T09:00:09Z,"Apartments Are Stocked, Toys Donated. Only the Refugees Are Missing. - The New York Times",https://www.nytimes.com:443/2018/05/16/us/refugee-admissions.html?partner=rss&emc=rss,,"Democratic Republic of the Congo,Islamic Republic of Iran,Republic of Iraq,Republic of the Congo,Republic of the Sudan,Somalia,Syrian Arab Republic,Union of Burma,United States",relevant,Web
20180531044611567,2018-05-31T09:43:22Z,"FOUNDING FATHER'S MEMOIRS: This committee of a kangaroo Parly can go to hell, Cdes - The Financial Gazette",http://www.financialgazette.co.zw:80/founding-fathers-memoirs-this-committee-of-a-kangaroo-parly-can-go-to-hell-cdes/,,"Republic of Angola,Republic of Haiti,Republic of Yemen,Republic of Zimbabwe,Somalia",relevant,Web
20180626200548119,2018-06-27T00:01:31Z,Supreme Court travel ban ruling,http://rssfeeds.commercialappeal.com:80/~/554819634/0/memphis/home~Supreme-Court-travel-ban-ruling-could-have-a-big-impact-in-Memphis/,,"Bolivarian Republic of Venezuela,Democratic People's Republic of Korea,Islamic Republic of Iran,Lebanon,Libya,Republic of El Salvador,Republic of India,Republic of Iraq,Republic of Yemen,Somalia,Syrian Arab Republic,United States",relevant,Web
20180810102914637,2018-08-10T15:23:41Z,A Yemeni-American Wanted To Bring His Family Home. Then Came The Travel Ban. | World News | forimmediaterelease.net,https://forimmediaterelease.net:443/a-yemeni-american-wanted-to-bring-his-family-home-then-came-the-travel-ban-392433/,,"Bolivarian Republic of Venezuela,Democratic People's Republic of Korea,Islamic Republic of Iran,Libya,Republic of Djibouti,Republic of Yemen,Somalia,Syrian Arab Republic,United States",relevant,Web
20181217011131198,2018-05-16T05:00:00Z,"Apartments Are Stocked, Toys Donated. Only the Refugees Are Missing.",https://advance.lexis.com/api/document?collection=News&id=urn:contentItem:5SBK-2951-JBG3-629T-00000-00&context=1516831,The New York Times,"Democratic Republic of the Congo,Islamic Republic of Iran,Republic of Iraq,Republic of the Congo,Republic of the Sudan,Somalia,Syrian Arab Republic,Union of Burma,United States",relevant,BulkLexisNexis_v2
