aid,publication_date,title,url,publisher,country,status,source_name
20150513125962332,2015-05-13T09:54:35.519Z,IRIN Global | Help at last for Sri Lanka war widows   | Sri Lanka | Aid Policy | Conflict | Gender Issues,http://www.irinnews.org:80/Report/101486/Help-at-last-for-Sri-Lanka-war-widows,,"Arab Republic of Egypt,Bangladesh,Burkina Faso,Central African Republic,Democratic Socialist Republic of Sri Lanka,Eswatini,Federal Democratic Republic of Ethiopia,Gabonese Republic,Gambia,Independent State of Papua New Guinea,Islamic Republic of Afghanistan,Islamic Republic of Iran,Islamic Republic of Pakistan,Kingdom of Cambodia,Kingdom of Thailand,Republic of Angola,Republic of Benin,Republic of Botswana,Republic of Burundi,Republic of Cabo Verde,Republic of Cameroon,Republic of Chad,Republic of Djibouti,Republic of Equatorial Guinea,Republic of Ghana,Republic of Haiti,Republic of Indonesia,Republic of Iraq,Republic of Rwanda,Republic of Sierra Leone,Republic of South Africa,Republic of Tajikistan,Republic of the Philippines,Republic of the Sudan,Somalia,State of Eritrea,State of Israel,Syrian Arab Republic,United Republic of Tanzania",relevant,Web
20150327125964750,2015-03-27T16:47:38.429Z,Opinion: No choice for Nigeria | Africa | DW.DE | 27.03.2015,http://www.dw.de:80/opinion-no-choice-for-nigeria/a-18345775?maca=en-rss-en-world-4025-rdf,,"Federal Republic of Nigeria,Republic of Liberia",relevant,Web
20150416125969241,2015-04-16T14:52:02.363Z,"Buhari, Ezekwesili, Chimamanda make Time's influential list - The Nation",http://thenationonlineng.net:80/new/buhari-ezekwesili-chimamanda-make-times-influential-list/,,"Federal Republic of Nigeria,Republic of Uganda",relevant,Web
20150323125950569,2015-03-23T07:00:00Z,"allAfrica.com: Nigerians're Clamouring for Change More Than APC, Buhari Tells Private Sector Forum",http://allafrica.com:80/stories/201503230201.html,,Federal Republic of Nigeria,relevant,Web
20150511125960211,2015-05-11T09:00:00Z,allAfrica.com: Sierra Leone: AU Nigerian Ebola Response Contingent Bids Health Ministry Farewell,http://allafrica.com:80/stories/201505110535.html,,"Federal Republic of Nigeria,Republic of Guinea,Republic of Liberia,Republic of Sierra Leone",relevant,Web
20150401125962825,2015-04-01T09:34:54.646Z,INEC Centre Disruption: Orubebe’s Action Could Plunge Nigeria Into Civil War – Festus Keyamo | Nigerian Current,http://www.nigeriancurrent.com:80/ck88-news/inec-centre-disruption-orubebes-action-could-plunge-nigeria-into-civil-war-festus-keyamo,,Federal Republic of Nigeria,relevant,Web
20150412125960936,2015-04-12T10:28:20.650Z,The Bitter Truth About The Igbo | The Abuja Voice,http://feedproxy.google.com:80/~r/abujavoice/eKIP/~3/wA5liJnab6k/,,Federal Republic of Nigeria,relevant,Web
20181216001632825,2015-04-12T05:00:00Z,Smart Girls vs. Bombs,https://advance.lexis.com/api/document?collection=News&id=urn:contentItem:5FRF-CWG1-DXY4-X1VK-00000-00&context=1516831,The New York Times,"Federal Republic of Nigeria,Islamic Republic of Afghanistan,Islamic Republic of Iran,Islamic Republic of Pakistan,Republic of Cuba,Republic of Yemen,United States",relevant,BulkLexisNexis_v2
20150401125960009,2015-04-01T06:50:57Z,"Number of worldwide death sentences on the rise but executions drop – Amnesty International | euronews, world news",http://feedproxy.google.com:80/~r/euronews/en/news/~3/8f5ymBYZPGY/story01.htm,,"Arab Republic of Egypt,Bangladesh,Democratic People's Republic of Korea,Federal Republic of Nigeria,Hashemite Kingdom of Jordan,Islamic Republic of Iran,Islamic Republic of Pakistan,Kingdom of Saudi Arabia,People's Republic of China,Republic of Belarus,Republic of Botswana,Republic of Equatorial Guinea,Republic of India,Republic of Indonesia,Republic of Iraq,Republic of Singapore,South Sudan,State of Kuwait,United Arab Emirates,United States",relevant,Web
20150408125966614,2015-04-08T12:52:07Z,"Don’t see Ndigbo as enemies, Umeh tells Buhari",http://www.punchng.com:80/news/dont-see-ndigbo-as-enemies-umeh-tells-buhari/,,Federal Republic of Nigeria,relevant,Web
20150325125964336,2015-03-25T12:20:25.938Z,Journalist Docked For ‘Defaming’ GeneralsThe Union,http://theunion.com.ng:80/journalist-docked-for-defaming-generals/,,"Federal Republic of Nigeria,Republic of Angola,United Kingdom of Great Britain and Northern Ireland",relevant,Web
20150603125972627,2015-06-03T15:50:04.380Z,"Nigerian President First Lady's expensive-looking '$50,000 Cartier' watch draws ridicule - People - News - The Independent",http://rss.feedsportal.com:80/c/266/f/3495/s/46e71090/sc/28/l/0L0Sindependent0O0Cnews0Cpeople0Cnigerian0Epresident0Efirst0Eladys0Eexpensivelooking0E50A0A0A0A0Ecartier0Ewatch0Edraws0Eridicule0E10A2949730Bhtml/story01.htm,,"Federal Republic of Nigeria,Syrian Arab Republic",relevant,Web
20150513125962182,2015-05-13T09:45:59.135Z,US Withdraws Envoy-nomineeThe Union,http://theunion.com.ng:80/us-withdraws-envoy-nominee/,,"Federal Republic of Nigeria,Republic of Kenya,Somalia,United States",relevant,Web
20150506125968569,2015-05-06T13:19:41.914Z,"AP News | EagleHerald | Marinette, Wisconsin/Menominee, Michigan USA",http://hosted.ap.org:80/dynamic/stories/M/ML_ISLAMIC_STATE_DISPLACED_PEOPLE?SITE=WIMAR&SECTION=HOME&TEMPLATE=DEFAULT,,"Federal Republic of Nigeria,Republic of Iraq,Syrian Arab Republic,Ukraine",relevant,Web
20150620125964509,2015-06-20T11:40:28.010Z,"IS ahead in turf war with Al Qaeda: US
 | Business Standard News",http://www.business-standard.com:80/article/news-ians/is-ahead-in-turf-war-with-al-qaeda-us-115062000435_1.html,,"Arab Republic of Egypt,Federal Republic of Nigeria,Islamic Republic of Afghanistan,Islamic Republic of Pakistan,Libya,Republic of India,Republic of Iraq,Republic of Yemen,Somalia,Syrian Arab Republic",relevant,Web
20150326125964215,2015-03-26T11:34:20.620Z,IBB Angry Over President Jonathan’s Hate Campaign Documentary Against the Military | The Abuja Voice,http://feedproxy.google.com:80/~r/abujavoice/eKIP/~3/jLSTZ3qqoF8/,,Federal Republic of Nigeria,relevant,Web
20150325125975955,2015-03-25T23:34:22.553Z,Jonathan’s men out to demonize ex-military leaders - IBB - Vanguard News,http://www.vanguardngr.com:80/2015/03/jonathans-men-out-to-demonize-ex-military-leaders-ibb/,,"Federal Republic of Nigeria,Republic of Niger",relevant,Web
20150422125970200,2015-04-22T14:00:00Z,allAfrica.com: Nigeria's 2015 Elections - Prologue to the Past?,http://allafrica.com:80/stories/201504221604.html,,"Federal Democratic Republic of Ethiopia,Federal Republic of Nigeria,Republic of Cabo Verde,Republic of Mauritius,Republic of Namibia,Republic of Rwanda",relevant,Web
20150515125960064,2015-05-15T07:46:37.327Z,"Obasanjo Gives Buhari Tips On Security, Power, Others | Nigerian Current",http://www.nigeriancurrent.com:80/ck85-politics/obasanjo-gives-buhari-tips-on-security-power-others,,"Federal Republic of Nigeria,Republic of Benin,Republic of Guinea,Republic of Mali",relevant,Web
20150419125962698,2015-04-20T00:06:38.389Z,"David West, Idika Kalu, Ndah-Isaiah, Fashola, Abdulahi, Akeredolu may make Buhari’s cabinet",http://sunnewsonline.com:80/new/?p=115437,,"Federal Republic of Nigeria,Republic of Liberia",relevant,Web
20150617125969812,2015-06-17T12:00:00Z,allAfrica.com: Southern Africa: I'll Ask Zuma About U.S.$9.3 MIllion Botched Arms Deals - Buhari,http://allafrica.com:80/stories/201506171078.html,,"Federal Republic of Nigeria,Republic of South Africa",relevant,Web
20150525125959632,2015-05-25T10:15:35.127Z,God answered my prayer for Nigeria - Jonathan - Vanguard News,http://www.vanguardngr.com:80/2015/05/god-answered-my-prayer-for-nigeria-jonathan/,,Federal Republic of Nigeria,irrelevant,Web
20150321125957019,2015-03-22T00:17:35.641Z,"Our students’ll not be used as political thugs – Prof Fidelis Okoro, VC, Ojukwu University",http://sunnewsonline.com:80/new/?p=110275,,"Arab Republic of Egypt,Bosnia and Herzegovina,Federal Republic of Nigeria,Republic of Rwanda",relevant,Web
20150518125961440,2015-05-18T10:43:00.493Z,IRIN Africa | Film: When the war came back - A South Sudan village relives the effects of conflict | South Sudan | Conflict | Health & Nutrition | Refugees/IDPs | Water & Sanitation,http://www.irinnews.org:80/Report/101507/Film-When-the-war-came-back-A-South-Sudan-village-relives-the-effects-of-conflict,,"Arab Republic of Egypt,Bangladesh,Burkina Faso,Central African Republic,Democratic Socialist Republic of Sri Lanka,Eswatini,Federal Democratic Republic of Ethiopia,Gabonese Republic,Gambia,Independent State of Papua New Guinea,Islamic Republic of Afghanistan,Islamic Republic of Iran,Islamic Republic of Pakistan,Kingdom of Cambodia,Kingdom of Thailand,Republic of Angola,Republic of Benin,Republic of Botswana,Republic of Burundi,Republic of Cabo Verde,Republic of Cameroon,Republic of Chad,Republic of Djibouti,Republic of Equatorial Guinea,Republic of Ghana,Republic of Haiti,Republic of Indonesia,Republic of Iraq,Republic of Rwanda,Republic of Sierra Leone,Republic of South Africa,Republic of Tajikistan,Republic of the Philippines,Republic of the Sudan,Somalia,South Sudan,State of Eritrea,State of Israel,Syrian Arab Republic,United Republic of Tanzania",relevant,Web
20150519125964805,2015-05-19T11:00:00Z,"allAfrica.com: Nigeria: PDP Shuts Down Social Media Account, Says Party Did Not Fail Nigeria",http://allafrica.com:80/stories/201505191170.html,,Federal Republic of Nigeria,relevant,Web
20150621125971468,2015-06-21T19:00:00Z,allAfrica.com: Chad: Govt Ban On Islamic Veil After Attacks Divides Muslims,http://allafrica.com:80/stories/201506210171.html,,"Federal Republic of Nigeria,Republic of Cameroon,Republic of Chad,Republic of Senegal,Republic of Tunisia",relevant,Web
20190405213460444,2015-06-21T05:00:00Z,"Angola arrests 13 dissident youths, including rapper",https://advance.lexis.com/api/document?collection=News&id=urn:contentItem:5G8H-XW91-DY93-M0G9-00000-00&context=1516831,Agence France Presse - English,"Federal Republic of Nigeria\, Nigeria,Republic of Angola\, Angola",relevant,BulkLexisNexis
20150323125968647,2015-03-24T01:56:22Z,"ISIS 'diverting attention' from setbacks, AsiaOne World News",http://asiaone.feedsportal.com:80/c/34151/f/618417/s/44b8ff90/sc/11/l/0Lnews0Basiaone0N0Cnews0Cworld0Cisis0Ediverting0Eattention0Esetbacks/story01.htm,,"Arab Republic of Egypt,Federal Republic of Nigeria,Libya,People's Democratic Republic of Algeria,Republic of France,Republic of Iraq,Republic of Tunisia,Republic of Yemen,Syrian Arab Republic",relevant,Web
20150524125956507,2015-05-24T10:08:38.281Z,Gen. Danjuma Constructs Two Bridges Worth N500m In Taraba |,http://leadership.ng:80/news/435793/gen-danjuma-constructs-two-bridges-worth-n500m-in-taraba,,,relevant,Web
20150509125968154,2015-05-09T19:48:25.723Z,CHEESEMAN: It’s time Nkurunziza leaves office before he gets any more - Africa | Daily Nation,http://www.nation.co.ke:80/news/africa/Nkurunziza-leave-office-before-he-gets-any-more-blood/-/1066/2711578/-/uphsqyz/-/index.html,,"Burkina Faso,Democratic Republic of the Congo,Federal Republic of Nigeria,Gabonese Republic,Republic of Angola,Republic of Burundi,Republic of Chad,Republic of Djibouti,Republic of Kenya,Republic of Namibia,Republic of Niger,Republic of Rwanda,Republic of Uganda,Republic of Zambia,Republic of the Sudan,Togolese Republic,United Republic of Tanzania",relevant,Web
20150401125961423,2015-04-01T08:08:56Z,"Egypt, Nigeria account for over 1000 death sentences announced in 2014 | The Indian Express",http://indianexpress.com:80/article/world/middle-east-africa/egypt-nigeria-account-for-over-1000-death-sentences-announced-in-2014/,,"Arab Republic of Egypt,Democratic People's Republic of Korea,Federal Republic of Nigeria,Georgia,Islamic Republic of Iran,Kingdom of Saudi Arabia,People's Republic of China,Republic of Iraq,Syrian Arab Republic,United States",relevant,Web
20150407125970594,2015-04-07T18:36:58.880Z,Falana Urges Akiolu To Apologise To Igbos | Nigerian News from Leadership News,http://leadership.ng:80/news/423789/falana-urges-akiolu-to-apologise-to-igbos,,Federal Republic of Nigeria,relevant,Web
20150416125980350,2015-04-17T03:08:12.977Z,"Buhari, Ezekwesili, Chimamanda Make TIME’s 100 Most Influential People |",http://leadership.ng:80/news/426235/buhari-ezekwesili-chimamanda-make-times-100-most-influential-people,,Federal Republic of Nigeria,relevant,Web
20150422125981726,2015-04-22T23:28:22Z,Senator Uche Chukwumerije: 1939-2015 - Editorial,http://dailyindependentnig.com:80/2015/04/senator-uche-chukwumerije-1939-2015/,,"Federal Republic of Nigeria,Republic of Angola",relevant,Web
20150531125961601,2015-05-31T21:03:19.762Z,"Many injured in Imo Police, MASSOB clash - Vanguard News",http://www.vanguardngr.com:80/2015/05/many-injured-in-imo-police-massob-clash/,,Federal Republic of Nigeria,relevant,Web
20150404125922649,2015-04-04T14:18:53Z,"Gov election: Don’t be discouraged, Mua’zu begs PDP members",http://www.punchng.com:80/news/gov-election-dont-be-discouraged-muazu-begs-pdp-members/,,Federal Republic of Nigeria,relevant,Web
20150617125963721,2015-06-17T08:41:20.352Z,We’ll Not Be Intimidated By Criticism – CDS Badeh | Nigerian Current,http://www.nigeriancurrent.com:80/ck88-news/well-not-be-intimidated-by-criticism-cds-badeh,,Federal Republic of Nigeria,relevant,Web
20150616125981333,2015-06-16T19:25:33.710Z,We Will Not Be Intimidated By Criticism – Badeh |,http://leadership.ng:80/news/440948/we-will-not-be-intimidated-by-criticism-badeh,,Federal Republic of Nigeria,relevant,Web
20150621125961823,2015-06-21T10:34:35Z,Chad's ban on Islamic veil after attacks divides Muslims | The National,http://www.thenational.ae:80/world/africa/chads-ban-on-islamic-veil-after-attacks-divides-muslims,,"Federal Republic of Nigeria,Republic of Cameroon,Republic of Chad,Republic of France,Republic of Tunisia",relevant,Web
20150510125966662,2015-05-10T18:55:42.411Z,Cry not for the Igbos - Vanguard News,http://www.vanguardngr.com:80/2015/05/cry-not-for-the-igbos/,,Federal Republic of Nigeria,relevant,Web
20150617125964703,2015-06-17T09:17:55.916Z,Global conflicts 'cost 13% of world GDP' - BBC News,http://www.bbc.co.uk:80/news/world-33161837,,"Central African Republic,Commonwealth of Australia,Federal Republic of Germany,Federal Republic of Nigeria,Federative Republic of Brazil,Hellenic Republic,Islamic Republic of Afghanistan,Islamic Republic of Pakistan,Kingdom of Spain,Libya,Republic of France,Republic of Iceland,Republic of Iraq,Syrian Arab Republic,United Kingdom of Great Britain and Northern Ireland",relevant,Web
20190401045632747,2015-03-30T05:00:00Z,AFPTV-Advisory 0900GMT,https://advance.lexis.com/api/document?collection=News&id=urn:contentItem:5FMV-BSG1-DY93-M2DS-00000-00&context=1516831,Agence France Presse - English,"Federal Republic of Nigeria\, Nigeria,Hong Kong Special Administrative Region\, Hong Kong,Islamic Republic of Iran\, Iran,Islamic Republic of Pakistan\, Pakistan,Kingdom of Spain\, Spain,Kingdom of the Netherlands\, Netherlands,People's Republic of China\, China,Repubblica Italiana\, Italy,Republic of Burundi\, Burundi,Republic of France\, France,Republic of Guinea\, Guinea,Republic of India\, India,Republic of Iraq\, Iraq,Republic of Korea\, South Korea,Republic of Sierra Leone\, Sierra Leone,Switzerland,Syrian Arab Republic\, Syria,Ukraine,Union of Burma\, Myanmar,United Kingdom of Great Britain and Northern Ireland\, United Kingdom",relevant,BulkLexisNexis
20150413125957246,2015-04-13T10:21:37.687Z,Kenyatta Asks UN To Remove Somali Refugee CampThe Union,http://theunion.com.ng:80/kenyatta-asks-un-to-remove-somali-refugee-camp/,,"Federal Republic of Nigeria,Republic of Kenya,Somalia,United States",relevant,Web
20150323125954404,2015-03-23T11:19:42.110Z,Power Struggle Escalates As Houthis Seize Strategic CityThe Union,http://theunion.com.ng:80/power-struggle-escalates-as-houthis-seize-strategic-city/,,"Federal Republic of Nigeria,Islamic Republic of Iran,Kingdom of Saudi Arabia,Republic of Yemen,United States",relevant,Web
20150602125985721,2015-06-03T03:15:13.781Z,Nkurunziza Waits On Election Umpire For Decision On ShiftThe Union,http://theunion.com.ng:80/nkurunziza-waits-on-election-umpire-for-decision-on-shift/,,"Federal Republic of Nigeria,Republic of Burundi,Republic of Kenya,Republic of Rwanda,Republic of South Africa,Republic of Uganda,United Republic of Tanzania",relevant,Web
20150525125962738,2015-05-25T12:42:08.076Z,Kiir Warns Against International SanctionsThe Union,http://theunion.com.ng:80/kiir-warns-against-international-sanctions/,,"Federal Republic of Nigeria,United States",relevant,Web
20150614125970232,2015-06-14T23:08:29.178Z,"Buhari, show Nigerians the right path, they will follow - Vanguard News",http://www.vanguardngr.com:80/2015/06/buhari-show-nigerians-the-right-path-they-will-follow/,,"Federal Republic of Nigeria,People's Republic of China",irrelevant,Web
20150409125964007,2015-04-09T10:00:00Z,"allAfrica.com: Tanzania/Egypt: Taifa Stars Draw Eagles, Pharaohs for Afcon",http://allafrica.com:80/stories/201504090816.html,,"Arab Republic of Egypt,Burkina Faso,Democratic Republic of the Congo,Eswatini,Federal Democratic Republic of Ethiopia,Federal Republic of Nigeria,Gabonese Republic,Gambia,Islamic Republic of Mauritania,Kingdom of Lesotho,Kingdom of Morocco,Libya,People's Democratic Republic of Algeria,Republic of Angola,Republic of Benin,Republic of Botswana,Republic of Burundi,Republic of Cabo Verde,Republic of Cameroon,Republic of Chad,Republic of Cote d'Ivoire,Republic of Djibouti,Republic of Equatorial Guinea,Republic of Ghana,Republic of Guinea,Republic of Kenya,Republic of Liberia,Republic of Madagascar,Republic of Malawi,Republic of Mali,Republic of Mozambique,Republic of Namibia,Republic of Niger,Republic of Rwanda,Republic of Senegal,Republic of Seychelles,Republic of Sierra Leone,Republic of South Africa,Republic of Tunisia,Republic of Uganda,Republic of Zambia,Republic of Zimbabwe,Republic of the Congo,Republic of the Sudan,Togolese Republic,Union of the Comoros,United Republic of Tanzania",irrelevant,Web
20150401125964633,2015-04-01T11:23:01.494Z,How 23 Nigerians Created 1 Million JobsThe Union,http://theunion.com.ng:80/how-23-nigerians-created-1-million-jobs/,,"Federal Republic of Nigeria,United States",irrelevant,Web
20150524125965898,2015-05-24T21:32:43.693Z,"Jonathan urges Nigerians to pray for incoming, outgoing administrations - Vanguard News",http://www.vanguardngr.com:80/2015/05/jonathan-urges-nigerians-to-prayer-for-incoming-outgoing-administrations/,,Federal Republic of Nigeria,relevant,Web
20150430125978507,2015-05-01T00:05:49.650Z,"Yoruba, others back to Pre-1952 era - Vanguard News",http://www.vanguardngr.com:80/2015/05/yoruba-others-back-to-pre-1952-era/,,"Federal Republic of Nigeria,Republic of Niger",relevant,Web
20150513081954435,2015-05-14T00:30:20Z,"Governance Reform In Nigeria: The Imperative Of A New National Productivity Paradigm (1) - Agenda, Opinion",http://dailyindependentnig.com:80/2015/05/governance-reform-nigeria-imperative-new-national-productivity-paradigm-1/,,Federal Republic of Nigeria,irrelevant,Web
20150506125968271,2015-05-06T13:05:38.365Z,[OPINION] Yar’adua! Wake Up! Nigeria Is Boiling (Part 2) By Obinna Akukwe | INFORMATION NIGERIA,http://www.informationng.com:80/2015/05/opinion-yaradua-wake-up-nigeria-is-boiling-part-2-by-obinna-akukwe.html,,"Federal Republic of Nigeria,Federative Republic of Brazil,Republic of Chad,Republic of Niger,Republic of the Sudan,United Kingdom of Great Britain and Northern Ireland",relevant,Web
20150526125982878,2015-05-26T23:20:52.192Z,"I can’t be a party to Nigeria’s disintegration, says Jonathan | The Nation",http://thenationonlineng.net:80/new/i-cant-be-a-party-to-nigerias-disintegration-says-jonathan/,,"Federal Republic of Nigeria,Republic of Korea",relevant,Web
20150409125961487,2015-04-09T07:47:54.661Z,International pressure mounts to end S.Sudan war: diplomats - Yahoo News,http://news.yahoo.com:80/international-pressure-mounts-end-sudan-war-diplomats-071727145.html,,"Federal Democratic Republic of Ethiopia,Federal Republic of Nigeria,Kingdom of Norway,People's Democratic Republic of Algeria,People's Republic of China,Republic of Chad,Republic of Rwanda,Republic of South Africa,Republic of Uganda,Republic of the Sudan,South Sudan,United Kingdom of Great Britain and Northern Ireland,United States",relevant,Web
20150326125973619,2015-03-26T20:20:25.538Z,Liberia's ex-president Charles Taylor will spend life in British jail: court,http://www.brisbanetimes.com.au:80/world/liberias-expresident-charles-taylor-will-spend-life-in-british-jail-court-20150327-1m8uqx.html,,"Federal Republic of Nigeria,Kingdom of Sweden,Republic of Finland,Republic of Liberia,Republic of Rwanda,Republic of Sierra Leone,United Kingdom of Great Britain and Northern Ireland",relevant,Web
20150522125965447,2015-05-22T15:50:52.048Z,IRIN Africa | Photo Feature: Burundi's Endless Exodus | Burundi | Tanzania | Children | Conflict | Early Warning | Refugees/IDPs | Water & Sanitation,http://www.irinnews.org:80/Report/101534/Photo-Feature-Burundi-apos-s-Endless-Exodus,,"Arab Republic of Egypt,Bangladesh,Burkina Faso,Central African Republic,Democratic Socialist Republic of Sri Lanka,Eswatini,Federal Democratic Republic of Ethiopia,Gabonese Republic,Gambia,Independent State of Papua New Guinea,Islamic Republic of Afghanistan,Islamic Republic of Iran,Islamic Republic of Pakistan,Kingdom of Cambodia,Kingdom of Thailand,Republic of Angola,Republic of Benin,Republic of Botswana,Republic of Burundi,Republic of Cabo Verde,Republic of Cameroon,Republic of Chad,Republic of Djibouti,Republic of Equatorial Guinea,Republic of Ghana,Republic of Haiti,Republic of Indonesia,Republic of Iraq,Republic of Rwanda,Republic of Sierra Leone,Republic of South Africa,Republic of Tajikistan,Republic of the Philippines,Republic of the Sudan,Somalia,State of Eritrea,State of Israel,Syrian Arab Republic,United Republic of Tanzania",relevant,Web
20150601125959505,2015-06-01T08:59:31.239Z,"Now, how will he govern? (3) Threats & dangers to the Jonathan Presidency",http://hallmarknews.com:80/now-how-will-he-govern-3-threats-dangers-to-the-jonathan-presidency/,,"Arab Republic of Egypt,Bolivarian Republic of Venezuela,Federal Republic of Nigeria,Georgia,Libya,Republic of Cuba,Republic of Ghana,Republic of Tunisia,Syrian Arab Republic,United States",relevant,Web
20150324125970940,2015-03-24T17:00:00Z,"allAfrica.com: Nigeria: The World is Watching Nigeria — America, Britain",http://allafrica.com:80/stories/201503241671.html,,"Federal Republic of Nigeria,United Kingdom of Great Britain and Northern Ireland,United States",relevant,Web
20150514125985917,2015-05-15T04:05:51.296Z,"Obasanjo Gives Buhari Clues On Security, Power, Others |",http://leadership.ng:80/news/433285/obasanjo-gives-buhari-clues-on-security-power-others,,"Federal Republic of Nigeria,Republic of Benin,Republic of Guinea,Republic of Mali",relevant,Web
20150515125959179,2015-05-15T07:00:00Z,"allAfrica.com: Nigeria: Obasanjo Gives Buhari Clues On Security, Power, Others",http://allafrica.com:80/stories/201505150115.html,,"Federal Republic of Nigeria,Republic of Benin,Republic of Guinea,Republic of Mali",relevant,Web
20150407125966684,2015-04-07T14:00:00Z,allAfrica.com: Nigeria: Oba of Lagos Should Apologise to Igbo People 'Without Delay' - Falana,http://allafrica.com:80/stories/201504071277.html,,Federal Republic of Nigeria,relevant,Web
20150518125959395,2015-05-18T09:00:00Z,allAfrica.com: Burundi: Ekweremadu Condemns Burundi Crisis,http://allafrica.com:80/stories/201505180631.html,,"Federal Republic of Nigeria,Republic of Burundi,Republic of Ghana",relevant,Web
20150521125978468,2015-05-22T01:47:20.347Z,"Arise, O Compatriots (2) | Nigerian Orient News",http://feeds.feedblitz.com:80/~/92803439/0/nigerianorientnews~Arise-O-Compatriots/,,"Federal Republic of Nigeria,Republic of Ghana,United States",relevant,Web
20150527125969813,2015-05-27T13:44:15.997Z,X-raying NYSC At 42The Union,http://theunion.com.ng:80/x-raying-nysc-at-42/,,Federal Republic of Nigeria,relevant,Web
20150524125969041,2015-05-25T00:56:31.828Z,Buhari can’t abandon South-East –Mbadinuju,http://sunnewsonline.com:80/new/?p=121277,,"Federal Republic of Nigeria,Republic of Niger",relevant,Web
20150402125974872,2015-04-03T01:46:17Z,Tasks before Buhari,http://www.punchng.com:80/elections2015/tasks-before-buhari/,,Federal Republic of Nigeria,relevant,Web
20150325125967411,2015-03-25T14:52:28.413Z,Milestones in nation's history - CNN.com,http://rss.cnn.com:80/~r/rss/edition_africa/~3/2amX-nkARXQ/index.html,,"Argentine Republic,Federal Republic of Nigeria,Federative Republic of Brazil,Republic of Cameroon",relevant,Web
20150522125953746,2015-05-22T07:01:14.400Z,The Namibian,http://www.namibian.com.na:80/indexx.php?id=26946,,"Central African Republic,Federal Republic of Nigeria,Libya,Republic of Burundi,Republic of Cameroon,Republic of Chad,Republic of Kenya,Republic of Mozambique,Republic of Niger,Republic of South Africa,South Sudan",relevant,Web
20150401125964661,2015-04-01T11:23:57.959Z,The Progressive Perspective Of A Passionate PatriotThe Union,http://theunion.com.ng:80/the-progressive-perspective-of-a-passionate-patriot/,,Federal Republic of Nigeria,relevant,Web
20150613125974350,2015-06-13T23:04:13Z,"June 12: The Democratic Journey So Far - Cover Choice, POLITICS",http://dailyindependentnig.com:80/2015/06/june-12-democratic-journey-far/,,"Federal Republic of Nigeria,Islamic Republic of Afghanistan,Kingdom of Cambodia,United States",relevant,Web
