aid,publication_date,title,url,publisher,country,status,source_name
20150421094934939,2015-04-21T14:49:29.332Z,The 1983 Planning and Development Atlas – a forgotten document? | Liberian Perspectives,http://blog.liberiapastandpresent.org:80/?p=604,,"Arab Republic of Egypt,Federal Democratic Republic of Ethiopia,Federal Republic of Nigeria,Gambia,Islamic Republic of Mauritania,Kingdom of the Netherlands,Libya,Portuguese Republic,Republic of Benin,Republic of Cabo Verde,Republic of Cameroon,Republic of Cote d'Ivoire,Republic of Djibouti,Republic of Ghana,Republic of Guinea,Republic of Guinea-Bissau,Republic of Kenya,Republic of Liberia,Republic of Madagascar,Republic of Mali,Republic of Niger,Republic of Seychelles,Republic of Sierra Leone,Republic of South Africa,Republic of Tunisia,Republic of Uganda,Republic of Zambia,Republic of Zimbabwe,Republic of the Sudan,United States",relevant,Web
20150513030809435,2015-05-13T20:08:03.027Z,The 1983 Planning and Development Atlas – a forgotten document? | Liberian Perspectives,http://blog.liberiapastandpresent.org:80/?p=604,,"Arab Republic of Egypt,Federal Democratic Republic of Ethiopia,Federal Republic of Nigeria,Gambia,Islamic Republic of Mauritania,Kingdom of the Netherlands,Libya,Portuguese Republic,Republic of Benin,Republic of Cabo Verde,Republic of Cameroon,Republic of Cote d'Ivoire,Republic of Djibouti,Republic of Ghana,Republic of Guinea,Republic of Guinea-Bissau,Republic of Kenya,Republic of Liberia,Republic of Madagascar,Republic of Mali,Republic of Niger,Republic of Seychelles,Republic of Sierra Leone,Republic of South Africa,Republic of Tunisia,Republic of Uganda,Republic of Zambia,Republic of Zimbabwe,Republic of the Sudan,United States",relevant,Web
20181216002305424,2015-04-29T05:00:00Z,"Leaders Are Mute, Even as Their People Die at Sea",https://advance.lexis.com/api/document?collection=News&id=urn:contentItem:5FW2-32K1-DXY4-X0CW-00000-00&context=1516831,The New York Times,"Federal Republic of Nigeria,Gambia,Republic of Mali,Republic of Senegal",relevant,BulkLexisNexis_v2
20150616125971943,2015-06-16T13:20:26Z,Religious liberty under siege around the world | The Japan Times,http://feedproxy.google.com:80/~r/japantimes_news/~3/VDblWw4R3wQ/,,"Arab Republic of Egypt,Central African Republic,Democratic People's Republic of Korea,Federal Republic of Nigeria,Islamic Republic of Afghanistan,Islamic Republic of Iran,Islamic Republic of Pakistan,Kingdom of Saudi Arabia,Lao People's Democratic Republic,Malaysia,People's Republic of China,Republic of Azerbaijan,Republic of Cuba,Republic of India,Republic of Indonesia,Republic of Iraq,Republic of Kazakhstan,Republic of Tajikistan,Republic of Uzbekistan,Republic of the Sudan,Russian Federation,Socialist Republic of Vietnam,State of Eritrea,Syrian Arab Republic,Turkmenistan,Union of Burma,United States",relevant,Web
20150619125981401,2015-06-20T03:24:09.462Z,Global 'terror' death toll soared in 2014 - US - The Manila Times OnlineThe Manila Times Online,http://www.manilatimes.net:80/global-terror-death-toll-soared-in-2014-us/193428/,,"Federal Republic of Nigeria,Islamic Republic of Afghanistan,Islamic Republic of Iran,Islamic Republic of Pakistan,Lebanon,Republic of Iraq,Republic of the Philippines,Syrian Arab Republic,United States",relevant,Web
20150622125969014,2015-06-22T11:32:58.081Z,Iraq tops ‘most dangerous’ place in world list — RT UK,http://rt.com:80/uk/268810-top-ten-dangerous-countries/?utm_source=rss&utm_medium=rss&utm_campaign=RSS,,"Federal Republic of Nigeria,Islamic Republic of Afghanistan,Islamic Republic of Pakistan,Kingdom of Saudi Arabia,Lebanon,Republic of France,Republic of India,Republic of Iraq,Republic of Yemen,Russian Federation,Syrian Arab Republic,Ukraine,United Kingdom of Great Britain and Northern Ireland,United States",relevant,Web
20150430125963143,2015-04-30T10:00:00Z,allAfrica.com: Mali: 'Guerrilla Gardening' Takes Root in Hunger-Hit Mali,http://allafrica.com:80/stories/201504300679.html,,"Federal Republic of Nigeria,Republic of Cameroon,Republic of Ghana,Republic of Malawi,Republic of Mali,Republic of Niger",relevant,Web
20150503125967978,2015-05-03T18:05:36.999Z,WARAH: Suspect oil deals are sure to add fuel to the fire that is - Opinion | Daily Nation,http://www.nation.co.ke:80/oped/Opinion/Suspect-oil-deals-are-sure-to-add-fuel-to-the-fire/-/440808/2705396/-/12p4cisz/-/index.html,,"Federal Republic of Nigeria,Republic of Iraq,Republic of Kenya,Somalia,United Kingdom of Great Britain and Northern Ireland",relevant,Web
20150428125975481,2015-04-28T21:51:17.510Z,"Buhari, Gerontocracy and early missteps | 
 Peoples Daily Newspaper",http://feedproxy.google.com:80/~r/PeoplesDailyNg/~3/MA2JFzGHY48/,,Federal Republic of Nigeria,relevant,Web
20150429125961595,2015-04-29T10:50:03.090Z,"'Guerrilla gardening' takes root in hunger-hit Mali
| Reuters",http://feeds.reuters.com:80/~r/reuters/INworldNews/~3/dGBhoagwE6Q/story01.htm,,"Commonwealth of Australia,Federal Democratic Republic of Nepal,Federal Republic of Nigeria,Federative Republic of Brazil,Republic of Cameroon,Republic of Ghana,Republic of Indonesia,Republic of Malawi,Republic of Mali,Republic of Niger",irrelevant,Web
20150506125966077,2015-05-06T10:50:04Z,Record 38 million people internally displaced by conflicts: Watchdog - Channel NewsAsia,http://www.channelnewsasia.com:80/news/world/record-38-million-people/1829208.html,,"Democratic Republic of the Congo,Federal Republic of Nigeria,Italian Republic,Libya,Republic of Iraq,Republic of the Congo,Republic of the Sudan,Syrian Arab Republic,Ukraine",relevant,Web
20150507125967138,2015-05-07T13:24:48Z,Mental horror lingers for freed Boko Haram hostages | theSundaily,http://www.thesundaily.my:80/news/1411911,,"Federal Republic of Nigeria,Republic of Sierra Leone",relevant,Web
20150506125963646,2015-05-06T09:20:04.281Z,Over 38 million people 'internally displaced by conflicts' - Yahoo News,http://news.yahoo.com:80/over-38-million-people-internally-displaced-conflicts-090557357.html,,"Democratic Republic of the Congo,Federal Republic of Nigeria,Italian Republic,Libya,Republic of Iraq,Republic of the Congo,Republic of the Sudan,Syrian Arab Republic,Ukraine",relevant,Web
20150525125964977,2015-05-25T14:24:30.366Z,"Sierra Leone News: Africa Notebook « 
Awoko Newspaper",http://awoko.org:80/2015/05/19/sierra-leone-news-africa-notebook-47/,,"Federal Democratic Republic of Ethiopia,Federal Republic of Nigeria,Republic of Cabo Verde,Republic of Chad,Republic of Sierra Leone,Republic of Tunisia,Republic of Zimbabwe",irrelevant,Web
20150406125959532,2015-04-06T09:00:00Z,allAfrica.com: Nigeria: What Is to Be Done - the Task for the New Nigerian President,http://allafrica.com:80/stories/201504060918.html,,"Federal Republic of Nigeria,United States",relevant,Web
20150413125969558,2015-04-13T23:38:26.572Z,"New role for Southsouth, Southeast - The Nation",http://thenationonlineng.net:80/new/new-role-for-southsouth-southeast/,,"Federal Republic of Nigeria,Republic of Niger",relevant,Web
20150530125972791,2015-05-31T01:25:49.036Z,New Telegraph   – Buhari’s message of hope,http://newtelegraphonline.com:80/buharis-message-of-hope/,,Federal Republic of Nigeria,relevant,Web
20150408125963558,2015-04-08T09:55:40.982Z,A look at terrorist attacks and casualty figures in Iran in seven months » Iran Front Page,http://iranfrontpage.com:80/reports/2015/04/a-look-at-terrorist-attacks-and-casualty-figures-in-iran-in-seven-months/,,"Arab Republic of Egypt,Federal Republic of Nigeria,Islamic Republic of Iran,Republic of Iraq,Somalia,Syrian Arab Republic",relevant,Web
20150618125968140,2015-06-18T11:48:52.022Z,SA is sinking deeper into violence red zone - Times LIVE,http://www.timeslive.co.za:80/thetimes/2015/06/18/SA-is-sinking-deeper-into-violence-red-zone,,"Federal Republic of Nigeria,Hellenic Republic,Republic of Cameroon,Republic of Iceland,Republic of Niger,Republic of South Africa,Syrian Arab Republic",relevant,Web
20150618125974652,2015-06-18T16:01:17.732Z,Czech Republic ranked 10th most peaceful nation - PRAGUE POST | The Voice of Prague,http://www.praguepost.com:80/world-news/48405-czech-republic-ranked-10th-most-peaceful-nation,,"Commonwealth of Australia,Czechia,Federal Republic of Nigeria,Hellenic Republic,Japan,Kingdom of Denmark,Libya,New Zealand,Portuguese Republic,Republic of Austria,Republic of Finland,Republic of Iceland,Switzerland,Syrian Arab Republic,Ukraine",relevant,Web
20150618125969829,2015-06-18T12:50:39.655Z,South Sudan Again Tops Fragile States Index | Inter Press Service,http://www.ipsnews.net:80/2015/06/south-sudan-again-tops-fragile-states-index/?utm_source=rss&utm_medium=rss&utm_campaign=south-sudan-again-tops-fragile-states-index,,"Federal Republic of Nigeria,Georgia,Libya,Portuguese Republic,Republic of Cuba,Republic of Guinea,Republic of Iraq,Republic of Liberia,Republic of Sierra Leone,Republic of Yemen,Syrian Arab Republic,United States",relevant,Web
20150612125984400,2015-06-13T00:00:19.534Z,Boko Haram: Buhari and burden of political hypocrisy,http://www.punchng.com:80/politics/boko-haram-buhari-and-burden-of-political-hypocrisy/,,"Federal Republic of Nigeria,Kingdom of Belgium,Republic of Cameroon,Republic of Chad,Republic of Colombia,United Kingdom of Great Britain and Northern Ireland,United States",relevant,Web
20181216002854531,2015-05-19T05:00:00Z,Bridging Burundi's Dangerous Divisions,https://advance.lexis.com/api/document?collection=News&id=urn:contentItem:5G19-H211-JBG3-632N-00000-00&context=1516831,The New York Times,"Federal Republic of Nigeria,Republic of Burundi,United States",relevant,BulkLexisNexis_v2
20150608125980560,2015-06-08T19:55:11.748Z,Positive outlook on Africa marred by crises - Business News | IOL Business,http://www.iol.co.za:80/positive-outlook-on-africa-marred-by-crises-1.1869120,,"Arab Republic of Egypt,Federal Republic of Nigeria,Libya,Republic of Burundi,Republic of Chad,Republic of Mozambique,Republic of Rwanda,Republic of South Africa,South Sudan",relevant,Web
20150430125973012,2015-04-30T17:48:57Z,"Gwynne Dyer: From Al-Qaeda to ISIS, a guide to name-changing terrorist groups | Georgia Straight Vancouver's News & Entertainment Weekly",http://www.straight.com:80/news/442526/gwynne-dyer-al-qaeda-isis-guide-name-changing-terrorist-groups,,"Arab Republic of Egypt,Federal Republic of Nigeria,Republic of Iraq,Republic of Yemen,Somalia,Syrian Arab Republic,United States",relevant,Web
20150430125967020,2015-04-30T13:27:05.489Z,"Sierra Leone News: For Sierra Leone’s foreign minister, AfDB needs to build on what it has « 
Awoko Newspaper",http://awoko.org:80/2015/04/30/sierra-leone-news-for-sierra-leones-foreign-minister-afdb-needs-to-build-on-what-it-has/,,"Republic of Guinea,Republic of Liberia,Republic of Sierra Leone",irrelevant,Web
20181216001632574,2015-04-12T05:00:00Z,Rushing to Stake a Claim on the Market Frontier,https://advance.lexis.com/api/document?collection=News&id=urn:contentItem:5FRF-CWG1-DXY4-X1TC-00000-00&context=1516831,The New York Times,"Argentine Republic,Bangladesh,Democratic Socialist Republic of Sri Lanka,Federal Republic of Nigeria,Federal Republic of Yugoslavia,Federative Republic of Brazil,Islamic Republic of Pakistan,People's Republic of China,Republic of Chile,Republic of Colombia,Republic of Cuba,Republic of Ecuador,Republic of India,Republic of Kazakhstan,Republic of Kenya,Republic of Peru,Republic of the Philippines,Russian Federation,Socialist Republic of Vietnam,State of Kuwait,United States",irrelevant,BulkLexisNexis_v2
20150407125959463,2015-04-07T06:35:12Z,David Mark at 67 - News,http://dailyindependentnig.com:80/2015/04/david-mark-67/,,"Federal Republic of Nigeria,Kingdom of Saudi Arabia,Republic of Ghana,Republic of India,Republic of Niger,United Kingdom of Great Britain and Northern Ireland,United States",relevant,Web
20150430125976541,2015-04-30T21:37:54Z,Jonathan: 'My Phone Call to Buhari after Election Cemented Nigeria's Unity' - Metro Watch,http://metrowatchonline.com:80/jonathan-my-phone-call-to-buhari-after-election-cemented-nigerias-unity/,,"Federal Republic of Nigeria,Republic of Ghana,United States",relevant,Web
20150427125956093,2015-04-27T13:48:01.368Z,2015 elections: it is all over but…. | Nigerian Orient News,http://feeds.feedblitz.com:80/~/90263492/0/nigerianorientnews~elections-it-is-all-over-but%e2%80%a6/,,"Federal Republic of Nigeria,United States",relevant,Web
20150517125973824,2015-05-17T23:45:28.477Z,Obasanjo ‘development’ committee – again? - Vanguard News,http://www.vanguardngr.com:80/2015/05/obasanjo-development-committee-again/,,Federal Republic of Nigeria,relevant,Web
20150331125975438,2015-04-01T00:03:37Z,"Executions Down, but Death Sentences Spike in 2014 | Al Jazeera America",http://america.aljazeera.com:80/articles/2015/3/31/executions-down-but-death-sentences-spike-in-2014.html,,"Arab Republic of Egypt,Federal Republic of Nigeria,Islamic Republic of Iran,Kingdom of Saudi Arabia,Mongolia,People's Republic of China,Republic of Benin,Republic of Chad,Republic of Fiji,Republic of Iraq,Republic of Suriname,United States",relevant,Web
20190722034926626,2015-06-18T05:00:00Z,FOREIGN POLICY: SOUTH SUDAN AGAIN TOPS FRAGILE STATES INDEX,https://advance.lexis.com/api/document?collection=News&id=urn:contentItem:5G7S-M181-DYB4-T182-00000-00&context=1516831,Inter Press Service,"Federal Republic of Nigeria,Georgia,Libya,Portuguese Republic,Republic of Cuba,Republic of Guinea,Republic of Iraq,Republic of Liberia,Republic of Sierra Leone,Republic of Yemen,Syrian Arab Republic,United States",relevant,BulkLexisNexis_v2
20150501125963847,2015-05-01T14:36:20.469Z,The U.N. at 70:  Impressive Successes and Monumental Failures | Inter Press Service,http://www.ipsnews.net:80/2015/05/the-u-n-at-70-impressive-successes-and-monumental-failures/?utm_source=rss&utm_medium=rss&utm_campaign=the-u-n-at-70-impressive-successes-and-monumental-failures,,"Arab Republic of Egypt,Democratic People's Republic of Korea,Federal Republic of Nigeria,Islamic Republic of Afghanistan,Islamic Republic of Pakistan,Kingdom of Cambodia,Libya,Republic of India,Republic of Iraq,Republic of Rwanda,Republic of Tunisia,Republic of Yemen,State of Israel,Syrian Arab Republic,United States",relevant,Web
20150422125970227,2015-04-22T14:06:16.375Z,[OPINION] Prof Jega Is The Hero Of Nigeria’s Democratic Transition By Obinna Akukwe | INFORMATION NIGERIA,http://www.informationng.com:80/2015/04/opinion-prof-jega-is-the-hero-of-nigerias-democratic-transition-by-obinna-akukwe.html,,"Federal Republic of Nigeria,United States",relevant,Web
20190405212429112,2015-05-22T05:00:00Z,AFPTV Agenda,https://advance.lexis.com/api/document?collection=News&id=urn:contentItem:5G24-TH11-DY93-M42H-00000-00&context=1516831,Agence France Presse - English,"Commonwealth of Australia\, Australia,Federal Democratic Republic of Nepal\, Patheka\, Nepal,Federal Republic of Nigeria\, Nigeria,Hong Kong Special Administrative Region\, Hong Kong,Ireland,Kingdom of Thailand\, Thailand,Lebanon,Republic of France\, France,Republic of Indonesia\, Indonesia,Republic of Iraq\, Iraq,Republic of Kenya\, Kenya,Republic of Mali\, Mali,Republic of Yemen\, Yemen,Syrian Arab Republic\, Syria",relevant,BulkLexisNexis
20150401125970896,2015-04-01T17:35:01.576Z,"With Jonathan, Africa’s list of good losers gets longer | 
 The Zimbabwe Mail",http://thezimbabwemail.com:80/with-jonathan-africas-list-of-good-losers-gets-longer/,,"Federal Republic of Nigeria,Republic of Cote d'Ivoire,Republic of Senegal,Republic of Zambia",relevant,Web
20150417125963643,2015-04-17T19:11:12.197Z,UN chief calls for immediate cease-fire in Yemen,http://www.dailyexcelsior.com:80/un-chief-calls-for-immediate-cease-fire-in-yemen/,,"Federal Republic of Nigeria,Republic of Yemen,Somalia,South Sudan,State of the Vatican City,Syrian Arab Republic",relevant,Web
20150322125959134,2015-03-22T19:00:00Z,"allAfrica.com: Nigeria: Invest At Home, Royal Father Urges Ndigbo in Diaspora",http://allafrica.com:80/stories/201503220343.html,,Federal Republic of Nigeria,relevant,Web
20150323125955776,2015-03-23T12:31:59.683Z,IS offsets ‘caliphate’ defeats with new attacks abroad | The Manila Times Online,http://www.manilatimes.net:80/is-offsets-caliphate-defeats-with-new-attacks-abroad/171405/,,"Arab Republic of Egypt,Federal Republic of Nigeria,Libya,People's Democratic Republic of Algeria,Republic of France,Republic of Iraq,Republic of Tunisia,Republic of Yemen,Syrian Arab Republic",relevant,Web
20150323125956115,2015-03-23T12:52:22Z,Islamic State broadens its objectives following defeats in Iraq and Syria | South China Morning Post,http://www.scmp.com:80/news/world/article/1745481/islamic-state-broadens-its-objectives-following-defeats-iraq-and-syria,,"Arab Republic of Egypt,Federal Republic of Nigeria,Libya,People's Democratic Republic of Algeria,Republic of France,Republic of Iraq,Republic of Tunisia,Republic of Yemen,Syrian Arab Republic",relevant,Web
20150421111329007,2015-04-21T16:13:28.511Z,Mali country profile - Overview - BBC News,http://www.bbc.co.uk:80/news/world-africa-13881370,,"Federal Republic of Nigeria,Republic of France,Republic of Mali,Republic of Niger,Republic of Senegal",relevant,Web
20150603125958287,2015-06-03T06:53:21.865Z,African Union appoints high representative for South Sudan - Sudan Tribune: Plural news and views on Sudan,http://www.sudantribune.com:80/spip.php?article55202,,"Arab Republic of Egypt,Federal Republic of Nigeria,People's Democratic Republic of Algeria,Republic of Chad,Republic of Mali,Republic of Rwanda,Republic of South Africa,Republic of the Sudan,South Sudan",relevant,Web
20150529125975546,2015-05-30T00:23:11.802Z,World refugee crisis to worsen with climate change - The Malaysian Insider,http://www.themalaysianinsider.com:80/world/article/world-refugee-crisis-to-worsen-with-climate-change,,"Federal Republic of Nigeria,Lebanon,Syrian Arab Republic,United Kingdom of Great Britain and Northern Ireland,United States",relevant,Web
20150527125974122,2015-05-27T16:25:54.049Z,Obama’s Failed State Policy in Africa | Mareeg.com | World news | Editorial,http://www.mareeg.com:80/obamas-failed-state-policy-in-africa/,,"Central African Republic,Federal Republic of Nigeria,Libya,Republic of Burundi,Republic of Cuba,Republic of Kenya,Republic of Liberia,Republic of Mali,Republic of the Sudan,Somalia,State of Eritrea,United States",relevant,Web
20150528125983872,2015-05-29T02:43:00.273Z,Vikas Gora to speak on world peace in Brazil - The Hindu,http://www.thehindu.com:80/news/cities/Vijayawada/vikas-gora-to-speak-on-world-peace-in-brazil/article7258821.ece?utm_source=RSS_Feed&utm_medium=RSS&utm_campaign=RSS_Syndication,,"Argentine Republic,Bangladesh,Commonwealth of Australia,Federal Republic of Nigeria,Federative Republic of Brazil,Japan,Kingdom of Cambodia,Kingdom of Denmark,Kingdom of Norway,Kingdom of Spain,Republic of Costa Rica,Republic of Finland,Republic of Ghana,Republic of India,Republic of Liberia,Republic of South Africa,Republic of Uganda,Republic of Zambia,United Kingdom of Great Britain and Northern Ireland,United States",irrelevant,Web
20150617125976738,2015-06-17T16:22:30Z,Russia Ranked One of Least Peaceful Countries in World | News | The Moscow Times,http://www.themoscowtimes.com:80/news/article/523919.html,,"Commonwealth of Australia,Democratic People's Republic of Korea,Federal Republic of Nigeria,Kingdom of Denmark,New Zealand,People's Republic of China,Republic of Austria,Republic of Iceland,Russian Federation,Switzerland,Syrian Arab Republic,Ukraine,Union of Soviet Socialist Republics,United States",relevant,Web
20150619125970434,2015-06-19T17:16:18.696Z,"Iran Still Supports Terrorism, State Department Finds - The New York Times",http://www.nytimes.com:80/2015/06/20/world/middleeast/state-department-terrorism-report-iran-syria.html?partner=rss&emc=rss,,"Federal Republic of Nigeria,Islamic Republic of Afghanistan,Islamic Republic of Iran,Islamic Republic of Pakistan,Republic of Iraq,Republic of Yemen,Somalia,Syrian Arab Republic,United States",relevant,Web
20150505125954628,2015-05-05T08:24:38.792Z,Museveni faults UN's peace missions in Africa - Africa | Daily Nation,http://www.nation.co.ke:80/news/africa/Museveni-UN-of-sidelining-Africa-peace-missions/-/1066/2706600/-/fpxsrnz/-/index.html,,"Federal Republic of Nigeria,Libya,Republic of Mali,Republic of Rwanda,Republic of Uganda,Republic of the Sudan,Somalia,South Sudan",relevant,Web
20150428125972350,2015-04-28T18:52:07.231Z,"Sierra Leone News: Govt. to provide professionalism for RSLAF -VP Foh « 
Awoko Newspaper",http://awoko.org:80/2015/04/28/sierra-leone-news-govt-to-provide-professionalism-for-rslaf-vp-foh/,,"Federal Republic of Nigeria,People's Republic of China,Republic of Ghana,Republic of Sierra Leone,United Kingdom of Great Britain and Northern Ireland,United States",relevant,Web
20150513035202410,2015-05-13T20:52:01.527Z,Mali country profile - Overview - BBC News,http://www.bbc.co.uk:80/news/world-africa-13881370,,"Federal Republic of Nigeria,Republic of France,Republic of Mali,Republic of Niger,Republic of Senegal",relevant,Web
20150518125980831,2015-05-19T03:14:19.445Z,Intercept and destroy boats: EU agrees to military action on people smuggling,http://www.brisbanetimes.com.au:80/world/intercept-and-destroy-boats-eu-agrees-to-military-action-on-people-smuggling-20150519-gh4uw7.html,,"Federal Republic of Nigeria,Ireland,Italian Republic,Kingdom of Spain,Kingdom of Sweden,Libya,Republic of Mali,Somalia,Syrian Arab Republic",relevant,Web
20150911126003883,2015-04-19T05:00:00Z,"Tanzanian paper terms xenophobic attacks in SAfrica ""shameful""",,,"Federal Republic of Nigeria,Republic of Malawi,Republic of Mozambique,Republic of South Africa,Republic of Zimbabwe,United Republic of Tanzania",relevant,SWB
20190127232738804,2015-04-09T05:00:00Z,Norway to host conference on protecting schools from terror on 1 June,https://advance.lexis.com/api/document?collection=News&id=urn:contentItem:5FPT-P2P1-JC8S-C4YX-00000-00&context=1516831,BBC Monitoring: International Reports,"Argentine Republic,Federal Republic of Nigeria,Kingdom of Norway,Syrian Arab Republic",relevant,BulkLexisNexis_v2
20190722011154250,2015-06-03T05:00:00Z,The Almanac,https://advance.lexis.com/api/document?collection=News&id=urn:contentItem:5G4P-FKF1-JBT2-30H9-00000-00&context=1516831,UPI (United Press International),"Federal Republic of Nigeria,Islamic Republic of Iran,Japan,Syrian Arab Republic,United States",relevant,BulkLexisNexis_v2
20190127233120432,2015-04-19T05:00:00Z,"Tanzanian paper terms xenophobic attacks in SAfrica ""shameful""",https://advance.lexis.com/api/document?collection=News&id=urn:contentItem:5FSY-CXG1-DYRV-3259-00000-00&context=1516831,BBC Monitoring: International Reports,"Federal Republic of Nigeria,Republic of Malawi,Republic of Mozambique,Republic of South Africa,Republic of Zimbabwe,United Republic of Tanzania",relevant,BulkLexisNexis_v2
20150516125973360,2015-05-17T01:06:26.580Z,New Telegraph   – Close-up on Buhari’s interim ‘kitchen cabinet’,http://newtelegraphonline.com:80/close-up-on-buharis-interim-kitchen-cabinet/,,"Federal Republic of Nigeria,Republic of France,United Kingdom of Great Britain and Northern Ireland,United Republic of Tanzania,United States",irrelevant,Web
20150406125962796,2015-04-06T13:15:31.257Z,A Vote For ChanjiThe Union,http://theunion.com.ng:80/a-vote-for-chanji/,,Federal Republic of Nigeria,relevant,Web
20150328125952805,2015-03-28T23:13:23Z,Social media and Nigerian politics,http://www.punchng.com:80/columnists/trivia-constitutional/social-media-and-nigerian-politics/,,"Arab Republic of Egypt,Federal Republic of Nigeria,Republic of Tunisia",relevant,Web
20150423125970391,2015-04-24T00:22:34.290Z,New Telegraph   – Bigotry and challenges before Buhari,http://newtelegraphonline.com:80/bigotry-and-challenges-before-buhari/,,"Federal Republic of Nigeria,United States",relevant,Web
20150528125980784,2015-05-29T00:04:33.652Z,Change grapples with conservatism - The Nation,http://thenationonlineng.net:80/new/change-grapples-with-conservatism/,,Federal Republic of Nigeria,relevant,Web
20150606125977222,2015-06-06T23:01:22Z,"Boko Haram: Nigerian Military Officers On The Spot - Cover Choice, POLITICS",http://dailyindependentnig.com:80/2015/06/boko-haram-nigerian-military-officers-spot/,,"Federal Republic of Nigeria,Republic of Niger",relevant,Web
20150416125979167,2015-04-17T01:25:19Z,Defending women does not make me a feminist –Ndialo-Enaholo,http://www.punchng.com:80/entertainment/arts-life/defending-women-does-not-make-me-a-feminist-ndialo-enaholo/,,Federal Republic of Nigeria,irrelevant,Web
20150612125983486,2015-06-12T23:11:05.002Z,The elephant has fallen … does she deserve her fate? - Vanguard News,http://www.vanguardngr.com:80/2015/06/the-elephant-has-fallen-does-she-deserve-her-fate/,,"Federal Republic of Nigeria,Islamic Republic of Iran,United States",irrelevant,Web
20150616125965830,2015-06-16T09:49:30.013Z,Buhari's biggest risk will be to ignore the Igbos —Mbadinuju,http://hallmarknews.com:80/buharis-biggest-risk-will-be-to-ignore-the-igbos-mbadinuju/,,Federal Republic of Nigeria,relevant,Web
20150620125977572,2015-06-21T01:48:24.799Z,New Telegraph   – Dan Maraya Jos dies at 69,http://newtelegraphonline.com:80/dan-maraya-jos-dies-at-69/,,"Bangladesh,Federal Republic of Nigeria,Republic of India,Republic of Madagascar,Republic of Niger",irrelevant,Web
20150512125961544,2015-05-12T11:15:40.560Z,Why is Africa so unequal? - CNN.com,http://rss.cnn.com:80/~r/rss/edition_africa/~3/kVTMLDey4lY/index.html,,"Federal Democratic Republic of Ethiopia,Federal Republic of Nigeria,People's Republic of China,Republic of Angola,Republic of Cote d'Ivoire,Republic of Kenya,Republic of Mozambique,Republic of Rwanda,Republic of Sierra Leone,Republic of South Africa,Republic of Uganda,United Republic of Tanzania",irrelevant,Web
