aid,publication_date,title,url,publisher,country,status,source_name
20150331125969888,2015-03-31T17:11:14Z,Nigeria Q&A: Impact of a Buhari victory - FT.com,http://www.ft.com:80/cms/s/0/2c798426-d7ba-11e4-849b-00144feab7de.html?ftcamp=published_links%2Frss%2Fworld%2Ffeed%2F%2Fproduct,,"Federal Republic of Nigeria,Republic of Niger,Republic of South Africa",relevant,Web
20150324125976669,2015-03-25T00:20:53.568Z,Nigeria's oil pipelines are battleground for brittle democracy | World news | The Guardian,http://www.theguardian.com:80/world/2015/mar/24/nigerias-oil-pipelines-battleground-democracy,,"Federal Republic of Nigeria,United Kingdom of Great Britain and Northern Ireland",relevant,Web
20150414125960090,2015-04-14T11:01:15.327Z,[OPINION] Why Political Nomads Can’t Fix Nigeria By Omozuwa Gabriel Osamwonyi | INFORMATION NIGERIA,http://www.informationng.com:80/2015/04/opinion-why-political-nomads-cant-fix-nigeria-by-omozuwa-gabriel-osamwonyi.html,,"Federal Republic of Nigeria,Republic of India",relevant,Web
20150406125958029,2015-04-06T07:52:36.480Z,,http://www.menafn.com:80/1094152237/A-massacre-in-Africa?src=RSS,,"Federal Republic of Nigeria,Islamic Republic of Iran,Islamic Republic of Pakistan,Republic of Kenya,Republic of Singapore,Republic of the Sudan,Somalia,Ukraine,United States",relevant,Web
20150410125951796,2015-04-10T23:13:30.484Z,Buhari’s untold story,http://sunnewsonline.com:80/new/?p=113811,,"Federal Republic of Nigeria,Republic of India,United Kingdom of Great Britain and Northern Ireland",relevant,Web
20150511124518695,2015-05-11T05:45:17.141Z,Kaberuka’s star performance leaves big shoes to fill at AfDB | Columnists | BDlive,http://www.bdlive.co.za:80/opinion/columnists/2015/05/11/kaberukas-star-performance-leaves-big-shoes-to-fill-at-afdb,,"Arab Republic of Egypt,Federal Democratic Republic of Ethiopia,Federal Republic of Nigeria,Japan,People's Republic of China,Republic of Cabo Verde,Republic of Chad,Republic of Mali,Republic of Rwanda,Republic of Sierra Leone,Republic of Tunisia,Republic of Zimbabwe",irrelevant,Web
20150617125968771,2015-06-17T11:39:30.230Z,"India a lowly 143 on Global Peace Index, violence costs over $340 bn to economy",http://www.hindustantimes.com:80/india-news/india-a-lowly-143-on-global-peace-index-violence-costs-over-340-bn-to-economy/article1-1359748.aspx,,"Federal Republic of Nigeria,Islamic Republic of Afghanistan,Islamic Republic of Pakistan,Republic of Iceland,Republic of India,Republic of Iraq,Syrian Arab Republic,Ukraine",relevant,Web
20150402125967480,2015-04-02T16:48:07.293Z,"Violence increases in election time, says German scholar | Pakistan News",http://pakistan.onepakistan.com.pk:80/news/city/karachi/361416-violence-increases-in-election-time-says-german-scholar.html,,"Arab Republic of Egypt,Federal Republic of Germany,Federal Republic of Nigeria,Islamic Republic of Pakistan",relevant,Web
20150415125962182,2015-04-15T08:41:27Z,Gowon advocates gov't of W'Africa - News,http://dailyindependentnig.com:80/2015/04/gowon-advocates-govt-wafrica/,,"Federal Republic of Nigeria,United States",relevant,Web
20150408125961360,2015-04-08T07:27:57.841Z,CAF Votes  For 2017  AFCON Hosts | :::…The Tide News Online:::…,http://www.thetidenewsonline.com:80/2015/04/08/caf-votes-for-2017-afcon-hosts/,,"Federal Republic of Nigeria,Gabonese Republic,Kingdom of Morocco,Libya,People's Democratic Republic of Algeria,Republic of Equatorial Guinea,Republic of Ghana,Republic of Tunisia,Republic of Zimbabwe",irrelevant,Web
20150407125963973,2015-04-07T11:55:42.126Z,BBC Sport - Caf set to vote for Afcon 2017 hosts,http://www.bbc.co.uk:80/sport/0/football/32204840,,"Federal Republic of Nigeria,Gabonese Republic,Kingdom of Morocco,Libya,People's Democratic Republic of Algeria,Republic of Equatorial Guinea,Republic of Ghana,Republic of Tunisia,Republic of Zimbabwe",irrelevant,Web
20150416125974937,2015-04-16T20:42:33.488Z,We Have No Regrets For Not Voting Buhari – Ndigbo | The Abuja Voice,http://feedproxy.google.com:80/~r/abujavoice/eKIP/~3/a5fsr889z0s/,,Federal Republic of Nigeria,relevant,Web
20150525125956107,2015-05-25T07:28:10.660Z,Cheers and more cheers as Dee Bob Ogbuagu turns 90,http://hallmarknews.com:80/cheers-and-more-cheers-as-dee-bob-ogbuagu-turns-90/,,"Federal Republic of Nigeria,Republic of Cameroon,Republic of Ghana",relevant,Web
20150519125958771,2015-05-19T07:00:00Z,"allAfrica.com: Nigeria: PDP Shuts Down Twitter, Facebook Accounts - Says Handle Hacked",http://allafrica.com:80/stories/201505190105.html,,Federal Republic of Nigeria,relevant,Web
20150414125959644,2015-04-14T10:32:48.201Z,Lagoon Tales From NigeriaThe Union,http://theunion.com.ng:80/lagoon-tales-from-nigeria/,,"Federal Republic of Nigeria,Republic of Rwanda,State of Israel",relevant,Web
20150411125965081,2015-04-12T01:27:43.877Z,"New Telegraph   – The Nigerian project, the Presidential election, the losers –Hall of shame (1)",http://newtelegraphonline.com:80/the-nigerian-project-the-presidential-election-the-losers-hall-of-shame-1/,,"Federal Republic of Nigeria,Republic of France,Republic of Ghana,State of Israel,United Kingdom of Great Britain and Northern Ireland",relevant,Web
20190223024040371,2015-06-18T05:00:00Z,Terrorists were a lot more active last year. Here is how much and why. ; Islamic State and Boko Haram were cited as two of the main forces behind increasingly lethal attacks.,https://advance.lexis.com/api/document?collection=News&id=urn:contentItem:5G80-ND21-DXKP-J0PG-00000-00&context=1516831,The Washington Post,"Federal Republic of Nigeria\, Nigeria,Islamic Republic of Afghanistan\, Afghanistan,Islamic Republic of Iran\, Iran,Islamic Republic of Pakistan\, Pakistan,Lebanon,Libya,Republic of Cuba\, Cuba,Republic of India\, India,Republic of Iraq\, Iraq,Republic of Yemen\, Yemen,Syrian Arab Republic\, Syria",relevant,BulkLexisNexis
20190223024447743,2015-06-22T05:00:00Z,"Iraq issues and Syria's civil war cause spike in terror, report says",https://advance.lexis.com/api/document?collection=News&id=urn:contentItem:5G8C-9GD1-JBFW-C0CB-00000-00&context=1516831,The Washington Post,"Federal Republic of Nigeria\, Nigeria,Islamic Republic of Afghanistan\, Afghanistan,Islamic Republic of Iran\, Iran,Islamic Republic of Pakistan\, Pakistan,Lebanon,Libya,Republic of Cuba\, Cuba,Republic of India\, India,Republic of Iraq\, Iraq,Republic of Yemen\, Yemen,Syrian Arab Republic\, Syria",relevant,BulkLexisNexis
20190223024447993,2015-06-22T05:00:00Z,"Iraq issues and Syria's civil war cause spike in terror, report says",https://advance.lexis.com/api/document?collection=News&id=urn:contentItem:5G8H-K441-DYX1-H115-00000-00&context=1516831,The Washington Post,"Federal Republic of Nigeria\, Nigeria,Islamic Republic of Afghanistan\, Afghanistan,Islamic Republic of Iran\, Iran,Islamic Republic of Pakistan\, Pakistan,Lebanon,Libya,Republic of Cuba\, Cuba,Republic of India\, India,Republic of Iraq\, Iraq,Republic of Yemen\, Yemen,Syrian Arab Republic\, Syria",relevant,BulkLexisNexis
20190223024729808,2015-06-22T05:00:00Z,"Iraq issues and Syria's civil war cause spike in terror, report says",https://advance.lexis.com/api/document?collection=News&id=urn:contentItem:5G84-CX91-DXXY-303J-00000-00&context=1516831,The Washington Post,"Federal Republic of Nigeria\, Nigeria,Islamic Republic of Afghanistan\, Afghanistan,Islamic Republic of Iran\, Iran,Islamic Republic of Pakistan\, Pakistan,Lebanon,Libya,Republic of Cuba\, Cuba,Republic of India\, India,Republic of Iraq\, Iraq,Republic of Yemen\, Yemen,Syrian Arab Republic\, Syria",relevant,BulkLexisNexis
20190223024729906,2015-06-22T05:00:00Z,"Iraq issues and Syria's civil war cause spike in terror, report says",https://advance.lexis.com/api/document?collection=News&id=urn:contentItem:5G89-KSR1-DYX1-H03H-00000-00&context=1516831,The Washington Post,"Federal Republic of Nigeria\, Nigeria,Islamic Republic of Afghanistan\, Afghanistan,Islamic Republic of Iran\, Iran,Islamic Republic of Pakistan\, Pakistan,Lebanon,Libya,Republic of Cuba\, Cuba,Republic of India\, India,Republic of Iraq\, Iraq,Republic of Yemen\, Yemen,Syrian Arab Republic\, Syria",relevant,BulkLexisNexis
20190405212938627,2015-05-26T05:00:00Z,Frontline Nigeria troops hope for better deal under Buhari,https://advance.lexis.com/api/document?collection=News&id=urn:contentItem:5G30-P3N1-JBV1-X194-00000-00&context=1516831,Agence France Presse - English,"Federal Republic of Nigeria\, Nigeria,Republic of Cameroon\, Cameroon,Republic of Chad\, Chad,Republic of Liberia\, Liberia,Republic of Niger\, Niger",relevant,BulkLexisNexis
20150401125967913,2015-04-01T14:30:26.326Z,"Egypt, Nigeria account for over 1,000 death sentences in 2014: AI - PanARMENIAN.Net",http://www.panarmenian.net:80/eng/news/190124/,,"Arab Republic of Egypt,Commonwealth of Australia,Democratic People's Republic of Korea,Federal Republic of Nigeria,Federative Republic of Brazil,Georgia,Hashemite Kingdom of Jordan,Islamic Republic of Iran,Islamic Republic of Pakistan,Kingdom of Saudi Arabia,People's Republic of China,Republic of Belarus,Republic of Equatorial Guinea,Republic of Indonesia,Republic of Iraq,Republic of Singapore,Syrian Arab Republic,Ukraine,United Arab Emirates,United States",relevant,Web
20150331125979322,2015-04-01T04:57:29.522Z,"Egypt, Nigeria accounted for over 1,000 death sentences in 2014, says Amnesty report - The Hindu",http://www.thehindu.com:80/news/amnesty-report-global-death-sentences-in-2014/article7056546.ece?utm_source=RSS_Feed&utm_medium=RSS&utm_campaign=RSS_Syndication,,"Arab Republic of Egypt,Commonwealth of Australia,Democratic People's Republic of Korea,Federal Republic of Nigeria,Federative Republic of Brazil,Georgia,Hashemite Kingdom of Jordan,Islamic Republic of Iran,Islamic Republic of Pakistan,Kingdom of Saudi Arabia,People's Republic of China,Republic of Belarus,Republic of Equatorial Guinea,Republic of Indonesia,Republic of Iraq,Republic of Singapore,Syrian Arab Republic,United Arab Emirates,United States",relevant,Web
20150402125962930,2015-04-02T12:00:00Z,"allAfrica.com: Egypt: Report - Egypt, Nigeria Led World in Death Sentences in 2014",http://allafrica.com:80/stories/201504021117.html,,"Arab Republic of Egypt,Commonwealth of Australia,Democratic People's Republic of Korea,Federal Republic of Nigeria,Federative Republic of Brazil,Georgia,Hashemite Kingdom of Jordan,Islamic Republic of Iran,Islamic Republic of Pakistan,Kingdom of Saudi Arabia,People's Republic of China,Republic of Belarus,Republic of Equatorial Guinea,Republic of Indonesia,Republic of Iraq,Republic of Singapore,Syrian Arab Republic,United Arab Emirates,United States",relevant,Web
20150407125975673,2015-04-08T00:43:59.957Z,New Telegraph   – Falana: Ndigbo deserve unreserved apology,http://newtelegraphonline.com:80/falana-ndigbo-deserve-unreserved-apology/,,Federal Republic of Nigeria,relevant,Web
20150407125974663,2015-04-07T23:33:43.912Z,Mark @ 67: The Journey so far - Vanguard News,http://www.vanguardngr.com:80/2015/04/mark-67-the-journey-so-far/,,"Federal Republic of Nigeria,Republic of Niger",relevant,Web
20150417125956581,2015-04-17T11:41:37.878Z,"Buhari, Chimamanda, Shekau, Ezekwesili, Others Make Time’s 100 Influential Persons List | Nigerian Current",http://www.nigeriancurrent.com:80/ck79-foreign-news/buhari-chimamanda-shekau-ezekwesili-others-make-times-100-influential-persons-list,,"Federal Republic of Nigeria,Kingdom of Saudi Arabia,Libya,Republic of Iraq,Republic of Uganda,Republic of Yemen,Russian Federation,State of Israel,Syrian Arab Republic,United States",relevant,Web
20150620125979220,2015-06-21T03:39:12.332Z,,http://www.menafn.com:80/1094255618/Nigeria-LNG-exports-reach-85bn-in-15-years?src=RSS,,"Federal Republic of Nigeria,Italian Republic,Japan,Kingdom of Saudi Arabia,Republic of Iraq,Republic of Yemen,Russian Federation,Syrian Arab Republic,United States",relevant,Web
20150621125976135,2015-06-22T00:22:06.248Z,Jonathan would have been the best if … – Mbadinuju | Nigerian Orient News,http://feeds.feedblitz.com:80/~/97219376/0/nigerianorientnews~Jonathan-would-have-been-the-best-if-%e2%80%a6-Mbadinuju/,,"Federal Republic of Nigeria,United Kingdom of Great Britain and Northern Ireland",relevant,Web
20150430125973439,2015-04-30T18:38:56.839Z,"Jonathan Urges Unity In PDP, Says Party Will Bounce Back |",http://leadership.ng:80/news/429795/jonathan-urges-unity-in-pdp-says-party-will-bounce-back,,Federal Republic of Nigeria,relevant,Web
20150430125967734,2015-04-30T14:02:54.529Z,"Buhari, Gerontocracy And Early MisstepsThe Union",http://theunion.com.ng:80/buhari-gerontocracy-and-early-missteps/,,Federal Republic of Nigeria,relevant,Web
20150416125971117,2015-04-16T16:41:25.193Z,"On Biafra, Ojukwu: Danjuma Can Now Shut Up | Imo Trumpeta",http://www.imotrumpeta.com:80/?p=13828,,Federal Republic of Nigeria,relevant,Web
20150612125988663,2015-06-13T03:37:06Z,"Not One Blow In The Crazy APC Civil War In Abuja! –Tony Okoroji - COLUMNISTS, Locomotion",http://dailyindependentnig.com:80/2015/06/not-one-blow-crazy-apc-civil-war-abuja-tony-okoroji/,,Federal Republic of Nigeria,relevant,Web
20150513125959516,2015-05-13T07:10:29Z,"Why I Sacked IGP Abba –Jonathan - News, Slider",http://dailyindependentnig.com:80/2015/05/sacked-igp-abba-jonathan/,,"Federal Republic of Nigeria,Republic of Cameroon,Republic of Chad,Republic of Mali,Republic of Niger,Republic of the Sudan",relevant,Web
20150528125981371,2015-05-29T00:26:45.730Z,New Telegraph   – The unsung heroes of 2015 elections,http://newtelegraphonline.com:80/the-unsung-heroes-of-2015-elections/,,"Federal Republic of Nigeria,Lebanon,Republic of Niger,State of the Vatican City",relevant,Web
20150612125963446,2015-06-12T08:34:29.420Z,"Full Text of Inaugural Address of 'President' MKO Abiola on June 11, 1994 - Vanguard News",http://www.vanguardngr.com:80/2015/06/full-text-of-inaugural-address-of-president-mko-abiola-on-june-11-1994/,,"Federal Republic of Nigeria,Republic of South Africa,United States",relevant,Web
20150401125976109,2015-04-01T23:40:05.276Z,Issues that shaped presidential and NASS polls,http://sunnewsonline.com:80/new/?p=112298,,"Federal Republic of Nigeria,Republic of Niger",relevant,Web
20150422125980852,2015-04-22T23:11:17.878Z,Our own brewing xenophobia - Vanguard News,http://www.vanguardngr.com:80/2015/04/our-own-brewing-xenophobia/,,"Federal Republic of Nigeria,Republic of South Africa,Republic of the Sudan",relevant,Web
20150616125986623,2015-06-16T23:44:24.551Z,Strong men have destroyed instititutions in Nigeria —BUHARI - Vanguard News,http://www.vanguardngr.com:80/2015/06/strong-men-have-destroyed-instititutions-in-nigeria-buhari/,,"Federal Republic of Germany,Federal Republic of Nigeria,Japan,Republic of Benin,Republic of Cameroon,Republic of Chad,Republic of France,Republic of Ghana,Republic of Niger,Republic of South Africa,Somalia,Union of Soviet Socialist Republics",relevant,Web
20150515121457968,2015-05-15T04:46:34Z,Chukwuemeka Ike: 50 Years In Writing - Ndigbo,http://dailyindependentnig.com:80/2015/05/chukwuemeka-ike-50-years-writing/,,,irrelevant,Web
20150619125974575,2015-06-19T20:32:25.145Z,Global ‘terror’ death toll soared in 2014: US | Pakistan Post,http://www.pakistanpost.pk:80/2015/06/global-terror-death-toll-soared-in-2014-us.html,,"Federal Republic of Nigeria,Islamic Republic of Afghanistan,Islamic Republic of Iran,Islamic Republic of Pakistan,Lebanon,Libya,Republic of Iraq,Republic of Yemen,Republic of the Philippines,Syrian Arab Republic,United States",relevant,Web
20150622125960515,2015-06-22T06:22:19.649Z,The Namibian,http://www.namibian.com.na:80/indexx.php?id=28175,,"Federal Republic of Nigeria,Republic of Chad,Republic of Senegal,Republic of Tunisia",relevant,Web
20150323125964333,2015-03-23T21:12:11Z,PDP will turn Lagos into  war zone – APC,http://www.punchng.com:80/news/pdp-will-turn-lagos-into-a-war-zone-apc/,,Federal Republic of Nigeria,relevant,Web
20150601125978338,2015-06-01T23:57:09.804Z,E/African Leaders Ask Burundi To Shift PollsThe Union,http://theunion.com.ng:80/eafrican-leaders-ask-burundi-to-shift-polls/,,"Federal Republic of Nigeria,Republic of Burundi,Republic of Kenya,Republic of Rwanda,Republic of Uganda,United Republic of Tanzania",relevant,Web
20150507125967845,2015-05-07T13:56:29.735Z,"13 Christian Killings Shrouded In Fear, MysteryThe Union",http://theunion.com.ng:80/13-christian-killings-shrouded-in-fear-mystery/,,"Federal Republic of Nigeria,Republic of Angola",relevant,Web
20150508125962498,2015-05-08T15:49:10.668Z,Nigerian medical team bids farewell : Sierra Leone Concord Times,http://slconcordtimes.com:80/nigerian-medical-team-bids-farewell/,,"Federal Republic of Nigeria,Republic of Guinea,Republic of Liberia,Republic of Sierra Leone",relevant,Web
20150519125964920,2015-05-19T11:49:28.891Z,Secret Gold Mines Threaten EconomyThe Union,http://theunion.com.ng:80/secret-gold-mines-threaten-economy/,,"Federal Republic of Nigeria,Republic of Cote d'Ivoire",relevant,Web
20150525125964083,2015-05-25T13:43:53.764Z,Jubilations As Slain Archbishop Romero Is BeatifiedThe Union,http://theunion.com.ng:80/jubilations-as-slain-archbishop-romero-is-beatified/,,"Federal Republic of Nigeria,Republic of El Salvador,State of the Vatican City,United States",relevant,Web
20150526125966919,2015-05-26T11:20:32.761Z,Worry Over Increased Violence Along Ivory Coast BorderThe Union,http://theunion.com.ng:80/worry-over-increased-violence-along-ivory-coast-border/,,"Federal Republic of Nigeria,Republic of Cote d'Ivoire,Republic of Ghana,Republic of Liberia,Republic of Niger",relevant,Web
20150605125976929,2015-06-05T18:02:45.938Z,Petroleum Refining: Why Super Majors ‘Shun’ Nigeria - Vanguard News,http://www.vanguardngr.com:80/2015/06/petroleum-refining-why-super-majors-shun-nigeria/,,"Bolivarian Republic of Venezuela,Federal Republic of Nigeria,Islamic Republic of Iran,Kingdom of Saudi Arabia,Kingdom of the Netherlands,Libya,People's Democratic Republic of Algeria,Republic of France,Republic of Iraq,Republic of Singapore,Republic of South Africa,State of Kuwait,State of Qatar,United Arab Emirates,United Kingdom of Great Britain and Northern Ireland,United States",relevant,Web
20190622011512232,2015-03-27T05:00:00Z,Nigerian leader urges peaceful vote as elections loom,https://advance.lexis.com/api/document?collection=News&id=urn:contentItem:5FM6-FDW1-DYN6-W54J-00000-00&context=1516831,The Associated Press (same day),"Federal Republic of Nigeria,Republic of Cote d'Ivoire,Republic of Kenya,United Kingdom of Great Britain and Northern Ireland,United States",relevant,BulkLexisNexis_v2
20150419125963157,2015-04-20T00:48:32.505Z,2015 Elections And Vindication Of Ngige’s ‘Biabia’ Politics |,http://leadership.ng:80/opinions/426915/2015-elections-and-vindication-of-ngiges-biabia-politics,,"Federal Republic of Nigeria,Republic of Niger",relevant,Web
20150424125979649,2015-04-25T01:08:49.447Z,New Telegraph   – Exit of a comrade,http://newtelegraphonline.com:80/exit-of-a-comrade/,,"Federal Republic of Nigeria,United Kingdom of Great Britain and Northern Ireland",relevant,Web
20150618125048054,2015-06-18T05:50:47.317Z,,http://www.menafn.com:80/1094252545/West-and-Central-Africa-discussed-coordination-and-synergies-to-contain-Avian-Influenza-Regional-consultation&src=RSS,,"Arab Republic of Egypt,Burkina Faso,Federal Republic of Nigeria,Hashemite Kingdom of Jordan,Republic of Benin,Republic of Cameroon,Republic of Chad,Republic of Ghana,Republic of Guinea,Republic of Mali,Republic of Niger,Republic of Senegal,Republic of Yemen,State of Qatar,Togolese Republic,United States",relevant,Web
20150424125964616,2015-04-24T10:06:26.972Z,Where is Nigeria heading to? - Vanguard News,http://www.vanguardngr.com:80/2015/04/where-is-nigeria-heading-to/,,"Federal Republic of Nigeria,Syrian Arab Republic",relevant,Web
20220113185503008,2015-03-27T05:00:00Z,Nigerian leader urges peaceful vote as elections loom,,Associated Press International,"Federal Republic of Nigeria,Republic of Cote d'Ivoire,Republic of Kenya,United Kingdom of Great Britain and Northern Ireland,United States",relevant,BulkLexisNexis_v2
20220114034647750,2015-03-27T05:00:00Z,Nigerian leader urges peaceful vote as elections loom,,Associated Press Online,"Federal Republic of Nigeria,Republic of Cote d'Ivoire,Republic of Kenya,United Kingdom of Great Britain and Northern Ireland,United States",relevant,BulkLexisNexis_v2
20150524125964647,2015-05-24T20:01:02.619Z,Niger Delta stands behind Jonathan even in defeat — Evah - Vanguard News,http://www.vanguardngr.com:80/2015/05/niger-delta-stands-behind-jonathan-even-in-defeat-evah/,,"Federal Republic of Nigeria,United Kingdom of Great Britain and Northern Ireland",relevant,Web
20150606125977788,2015-06-07T00:26:43.103Z,"Nigeria, ECOWAS and the celebration of economics of unity - Vanguard News",http://www.vanguardngr.com:80/2015/06/nigeria-ecowas-and-the-celebration-of-economics-of-unity/,,"Federal Democratic Republic of Ethiopia,Federal Republic of Nigeria,Islamic Republic of Mauritania,People's Republic of China,Republic of Benin,Republic of France,Republic of Ghana,Republic of Guinea,Republic of Liberia,Republic of Mali,Republic of Sierra Leone,Republic of South Africa,Republic of Tunisia,Togolese Republic,United States",relevant,Web
20150331125975675,2015-03-31T23:46:21Z,"Beloved country:  Step back from the precipice - Comment, Opinion",http://dailyindependentnig.com:80/2015/04/beloved-country-step-back-precipice/,,"Bolivarian Republic of Venezuela,Federal Republic of Nigeria,Republic of Benin,Republic of Cameroon,Republic of Mali,Republic of Niger,United Kingdom of Great Britain and Northern Ireland,United States",relevant,Web
20150417125959840,2015-04-17T14:48:26.557Z,"Ebola: Koroma Seeks $6 Billion Aid, Debt Cancellation For W/Africa |",http://leadership.ng:80/news/426379/ebola-koroma-seeks-6-billion-aid-debt-cancellation-for-wafrica,,"Federal Republic of Nigeria,Republic of Guinea,Republic of Liberia,Republic of Sierra Leone",relevant,Web
20150528125978331,2015-05-28T21:31:18.539Z,First Lady turns down Presidency of the African First Ladies Peace Mission | Cocorioko,http://cocorioko.info:80/first-lady-turns-down-presidency-of-the-african-first-ladies-peace-mission/,,"Federal Republic of Nigeria,Republic of Sierra Leone,United States",irrelevant,Web
20150425125966452,2015-04-25T23:29:25.244Z,AHEAD OF INAUGURATION: President-elect takes charge - Vanguard News,http://www.vanguardngr.com:80/2015/04/ahead-of-inauguration-president-elect-takes-charge/,,"Burkina Faso,Federal Republic of Nigeria,Islamic Republic of Iran,Kingdom of Morocco,People's Republic of China,Republic of Cote d'Ivoire,Republic of Equatorial Guinea,Republic of Ghana,Republic of Guinea,Republic of South Africa,State of Israel,Togolese Republic",relevant,Web
20150402125973907,2015-04-03T00:29:53Z,"Buhari: A hero then, a hero now - Letters, Opinion",http://dailyindependentnig.com:80/2015/04/buhari-hero-hero-now/,,"Federal Republic of Nigeria,United States",relevant,Web
20150421125971768,2015-04-22T00:50:41.644Z,New Telegraph   – Time to reform the Armed Forces,http://newtelegraphonline.com:80/time-to-reform-the-armed-forces/,,"Federal Republic of Nigeria,Republic of Liberia,Republic of Sierra Leone,United States",relevant,Web
20150617125968268,2015-06-17T11:22:16.653Z,Old age will limit my performance –Buhari - Royal Times of Nigeria Newspaper,http://royaltimes.net:80/old-age-will-limit-my-performance-buhari/,,"Federal Republic of Nigeria,Republic of Ghana,Republic of South Africa,Somalia,Union of Soviet Socialist Republics",relevant,Web
20150616125987532,2015-06-17T00:28:13.480Z,Buhari to probe Jonathan’s $9.7m failed arms contract - The Nation,http://thenationonlineng.net:80/new/buhari-to-probe-jonathans-9-7m-failed-arms-contract/,,"Federal Republic of Nigeria,Republic of South Africa,Union of Soviet Socialist Republics,United States",relevant,Web
20150326125977887,2015-03-27T01:08:07.209Z,Taxation In A Swivelling Economy |,http://leadership.ng:80/blogposts/420491/taxation-in-a-swivelling-economy,,"Federal Republic of Nigeria,United Kingdom of Great Britain and Northern Ireland",relevant,Web
20150326125967907,2015-03-26T14:51:53.909Z,Nigeria’s Buhari: Political has-been or cat with 9 lives? | Newstime Africa,http://www.newstimeafrica.com:80/archives/38291,,Federal Republic of Nigeria,relevant,Web
20150604125984694,2015-06-05T01:31:17.071Z,Amnesty Allegation: ‘Touch Ihejirika And See’The Union,http://theunion.com.ng:80/amnesty-allegation-touch-ihejirika-and-see/,,"Federal Republic of Nigeria,Kingdom of the Netherlands",relevant,Web
20150520125977396,2015-05-20T19:07:01.651Z,2015 general elections and survival of democracy in Nigeria - Vanguard News,http://www.vanguardngr.com:80/2015/05/2015-general-elections-and-survival-of-democracy-in-nigeria/,,Federal Republic of Nigeria,relevant,Web
20150529125966186,2015-05-29T15:29:39.779Z,Five things Buhari must tackle now that he's president - CNN.com,http://rss.cnn.com:80/~r/rss/edition_africa/~3/lc0RyLHRrJg/index.html,,"Argentine Republic,Federal Republic of Nigeria,Federative Republic of Brazil,Republic of Cameroon",relevant,Web
20150428125968582,2015-04-28T15:40:15.693Z,Board Approves Return Of Africa Rice Headquarters To Côte d’IvoireThe Union,http://theunion.com.ng:80/board-approves-return-of-africa-rice-headquarters-to-cote-divoire/,,"Federal Republic of Nigeria,Republic of Benin",irrelevant,Web
20150421125957231,2015-04-21T06:24:40.619Z,"Jonathan, Buhari, Atiku, Tambuwal, Ngige, Others Eulogise Chukwumerije | Nigerian Current",http://www.nigeriancurrent.com:80/ck88-news/jonathan-buhari-atiku-tambuwal-ngige-others-eulogise-chukwumerije,,Federal Republic of Nigeria,relevant,Web
