aid,publication_date,title,url,publisher,country,status,byline,source_name
20190617043229625,2013-05-29T05:00:00Z,Editorial Roundup: Excerpts from recent editorials,https://advance.lexis.com/api/document?collection=News&id=urn:contentItem:58HY-WPB1-JBGK-G1YB-00000-00&context=1516831,The Associated Press,"Democratic Republic of the Congo,Federal Democratic Republic of Ethiopia\, Ethiopia,Federal Republic of Germany\, Germany,Federative Republic of Brazil\, Brazil,Gabonese Republic\, Gabon,Islamic Republic of Afghanistan\, Afghanistan,Islamic Republic of Iran\, Iran,Islamic Republic of Mauritania\, Mauritania,Islamic Republic of Pakistan\, Pakistan,Kingdom of Belgium\, Belgium,Kingdom of Sweden\, Sweden,Kingdom of the Netherlands\, Netherlands,Repubblica Italiana\, Italy,Republic of Austria\, Austria,Republic of Cote d'Ivoire\, Ivory Coast,Republic of Cuba\, Cuba,Republic of France\, France,Republic of Guinea\, Guinea,Republic of Guinea-Bissau\, Guinea-Bissau,Republic of Iraq\, Iraq,Republic of Senegal\, Senegal,Republic of Yemen\, Yemen,Republic of Zambia\, Zambia,Republic of the Congo,Republic of the Sudan\, Sudan,Russian Federation\, Russia,State of Israel\, Israel,Syrian Arab Republic\, Syria,United Kingdom of Great Britain and Northern Ireland\, United Kingdom,United Republic of Tanzania\, Tanzania,United States",relevant,,BulkLexisNexis
20190617043229636,2013-05-29T05:00:00Z,Editorial Roundup: Excerpts from recent editorials,https://advance.lexis.com/api/document?collection=News&id=urn:contentItem:591M-1MG1-DXYN-626B-00000-00&context=1516831,The Associated Press (same day),"Democratic Republic of the Congo,Federal Democratic Republic of Ethiopia,Federal Republic of Germany,Federative Republic of Brazil,Gabonese Republic,Islamic Republic of Afghanistan,Islamic Republic of Iran,Islamic Republic of Mauritania,Islamic Republic of Pakistan,Italian Republic,Kingdom of Belgium,Kingdom of Sweden,Kingdom of the Netherlands,Republic of Austria,Republic of Cote d'Ivoire,Republic of Cuba,Republic of France,Republic of Guinea,Republic of Iraq,Republic of Senegal,Republic of Yemen,Republic of Zambia,Republic of the Congo,Republic of the Sudan,Russian Federation,State of Israel,Syrian Arab Republic,United Kingdom of Great Britain and Northern Ireland,United Republic of Tanzania,United States",relevant,The Associated Press,BulkLexisNexis_v2
20190218024828363,2013-06-15T05:00:00Z,"The Washington Post June 14, 2013 Friday",https://advance.lexis.com/api/document?collection=News&id=urn:contentItem:58VR-H121-JBFW-C4YP-00000-00&context=1516831,The Washington Post,"Republic of Austria\, Austria,Republic of Colombia\, Colombia,Republic of Uganda\, Uganda,United Kingdom of Great Britain and Northern Ireland\, United Kingdom,United States",irrelevant,,BulkLexisNexis
20190218024828196,2013-06-15T05:00:00Z,"Washingtonpost.com June 14, 2013 Friday 8:13 PM EST",https://advance.lexis.com/api/document?collection=News&id=urn:contentItem:58N6-FYR1-JCDY-T03N-00000-00&context=1516831,The Washington Post,"Republic of Austria\, Austria,Republic of Colombia\, Colombia,Republic of Uganda\, Uganda,United Kingdom of Great Britain and Northern Ireland\, United Kingdom,United States",irrelevant,,BulkLexisNexis
20140710126778446,2013-04-23T05:00:00Z,allAfrica.com: Burundi: Human Rights Reports: Burundi,http://allafrica.com/stories/201304231120.html,,"Democratic Republic of the Congo,Republic of Burundi,Somalia,Sultanate of Oman,United Republic of Tanzania",relevant,,Web
20190721234337589,2013-04-30T05:00:00Z,The Almanac -- weekly,https://advance.lexis.com/api/document?collection=News&id=urn:contentItem:589S-R851-DY83-T1VR-00000-00&context=1516831,UPI (United Press International),"Democratic People's Republic of Korea,Democratic Republic of Vietnam,Democratic Republic of the Congo,Democratic Socialist Republic of Sri Lanka,Federal Republic of Germany,Grand Duchy of Luxembourg,Ireland,Islamic Republic of Afghanistan,Islamic Republic of Pakistan,Italian Republic,Kingdom of Belgium,Kingdom of Spain,Kingdom of the Netherlands,People's Republic of China,Republic of Cameroon,Republic of Cuba,Republic of El Salvador,Republic of France,Republic of Ghana,Republic of India,Republic of Indonesia,Republic of Poland,Republic of South Africa,Republic of the Congo,Republic of the Sudan,Russian Federation,State of Israel,Syrian Arab Republic,Union of Soviet Socialist Republics,United Kingdom of Great Britain and Northern Ireland,United States",relevant,UNITED PRESS INTERNATIONAL,BulkLexisNexis_v2
20140710126779083,2013-04-23T05:00:00Z,allAfrica.com: Mali: Human Rights Reports - Mali,http://allafrica.com/stories/201304231085.html,,"Burkina Faso,Democratic Republic of the Congo,Islamic Republic of Mauritania,People's Democratic Republic of Algeria,Republic of Cote d'Ivoire,Republic of France,Republic of Mali,Republic of Niger",relevant,,Web
20140710126779391,2013-04-23T05:00:00Z,allAfrica.com: South Sudan: Human Rights Reports - South Sudan,http://allafrica.com/stories/201304231102.html,,"Central African Republic,Democratic Republic of the Congo,Federal Democratic Republic of Ethiopia,Republic of Kenya,Republic of Uganda,Republic of the Congo,Republic of the Sudan,South Sudan,State of Eritrea",relevant,,Web
20190721233151739,2013-03-26T05:00:00Z,The Almanac -- weekly,https://advance.lexis.com/api/document?collection=News&id=urn:contentItem:5829-RV51-JBT2-3125-00000-00&context=1516831,UPI (United Press International),"Arab Republic of Egypt,Argentine Republic,Democratic People's Republic of Korea,Democratic Republic of the Congo,Falkland Islands,Federal Republic of Germany,Hellenic Republic,Islamic Republic of Iran,Italian Republic,Japan,Kingdom of Belgium,Kingdom of Norway,Kingdom of Spain,Kingdom of Sweden,Kingdom of Thailand,Kingdom of the Netherlands,Kyrgyz Republic,Lebanon,Libya,Mexico,People's Republic of China,Principality of Monaco,Republic of Burundi,Republic of Cote d'Ivoire,Republic of Croatia,Republic of France,Republic of Guatemala,Republic of Iraq,Republic of Panama,Republic of Rwanda,Republic of South Africa,Republic of Zimbabwe,Republic of the Congo,Russian Federation,State of Israel,State of the Vatican City,Syrian Arab Republic,Union of Burma,Union of Soviet Socialist Republics,United Kingdom of Great Britain and Northern Ireland,United States",relevant,UNITED PRESS INTERNATIONAL,BulkLexisNexis_v2
20140710126779491,2013-04-23T05:00:00Z,allAfrica.com: Angola: Human Rights Reports - Angola,http://allafrica.com/stories/201304231087.html,,"Democratic Republic of the Congo,Portuguese Republic,Republic of Angola,Republic of Namibia,Republic of Zambia",relevant,,Web
20190218021143324,2013-03-28T05:00:00Z,"Washingtonpost.com March 29, 2013 Friday 8:13 PM EST",https://advance.lexis.com/api/document?collection=News&id=urn:contentItem:582S-PB91-DYX1-H0VX-00000-00&context=1516831,The Washington Post,"Democratic Republic of the Congo,Federal Republic of Germany\, Germany,German Democratic Republic\, Germany,Hashemite Kingdom of Jordan\, Jordan,Islamic Republic of Iran\, Iran,Mexico,Repubblica Italiana\, Italy,Republic of Chile\, Chile,Republic of Cuba\, Cuba,Republic of France\, France,Republic of Guatemala\, Guatemala,Republic of India\, India,Republic of Nicaragua\, Nicaragua,Republic of the Congo,Romania,State of Israel\, Israel,United States",relevant,,BulkLexisNexis
20190218021144897,2013-03-28T05:00:00Z,"The Washington Post March 29, 2013 Friday",https://advance.lexis.com/api/document?collection=News&id=urn:contentItem:582S-3C11-DXXY-314H-00000-00&context=1516831,The Washington Post,"Democratic Republic of the Congo,Federal Republic of Germany\, Germany,German Democratic Republic\, Germany,Hashemite Kingdom of Jordan\, Jordan,Islamic Republic of Iran\, Iran,Mexico,Repubblica Italiana\, Italy,Republic of Chile\, Chile,Republic of Cuba\, Cuba,Republic of France\, France,Republic of Guatemala\, Guatemala,Republic of India\, India,Republic of Nicaragua\, Nicaragua,Republic of the Congo,Romania,State of Israel\, Israel,United States",relevant,,BulkLexisNexis
20140710126777931,2013-04-23T05:00:00Z,allAfrica.com: Nigeria: 2012 Human Rights Reports,http://allafrica.com/stories/201304230414.html,,"Democratic Republic of the Congo,Federal Republic of Nigeria,Republic of Benin,Republic of Cameroon,Republic of Chad,Republic of Mali,Republic of Niger,Republic of the Sudan",relevant,,Web

