aid,publication_date,title,url,publisher,country,status,byline,source_name
20150129011940243,2015-01-29T19:19:39.403Z,IRIN Asia | Little hope of justice for Nepal’s war-time rape survivors | Nepal | Conflict | Economy | Gender Issues | Governance | Health & Nutrition,http://www.irinnews.org:80/Report/100423/Little-hope-of-justice-for-Nepal-s-war-time-rape-survivors,,"Arab Republic of Egypt,Bangladesh,Burkina Faso,Central African Republic,Democratic Socialist Republic of Sri Lanka,Eswatini,Federal Democratic Republic of Ethiopia,Federal Democratic Republic of Nepal,Gabonese Republic,Gambia,Independent State of Papua New Guinea,Islamic Republic of Afghanistan,Islamic Republic of Iran,Islamic Republic of Pakistan,Kingdom of Cambodia,Kingdom of Thailand,Republic of Angola,Republic of Benin,Republic of Botswana,Republic of Burundi,Republic of Cabo Verde,Republic of Cameroon,Republic of Chad,Republic of Djibouti,Republic of Equatorial Guinea,Republic of Ghana,Republic of Haiti,Republic of Indonesia,Republic of Iraq,Republic of Rwanda,Republic of Sierra Leone,Republic of South Africa,Republic of Tajikistan,Republic of the Philippines,Republic of the Sudan,Somalia,State of Eritrea,State of Israel,Syrian Arab Republic,United Republic of Tanzania",relevant,,Web
20150129014502118,2015-01-29T19:45:01.113Z,IRIN Africa | South Sudan’s child soldiers - a step backwards | South Sudan | Aid Policy | Children | Conflict | Economy | Governance | Human Rights,http://www.irinnews.org:80/Report/100534/South-Sudan-s-child-soldiers-a-step-backwards,,"Arab Republic of Egypt,Bangladesh,Burkina Faso,Central African Republic,Democratic Socialist Republic of Sri Lanka,Eswatini,Federal Democratic Republic of Ethiopia,Gabonese Republic,Gambia,Independent State of Papua New Guinea,Islamic Republic of Afghanistan,Islamic Republic of Iran,Islamic Republic of Pakistan,Kingdom of Cambodia,Kingdom of Thailand,Republic of Angola,Republic of Benin,Republic of Botswana,Republic of Burundi,Republic of Cabo Verde,Republic of Cameroon,Republic of Chad,Republic of Djibouti,Republic of Equatorial Guinea,Republic of Ghana,Republic of Haiti,Republic of Indonesia,Republic of Iraq,Republic of Rwanda,Republic of Sierra Leone,Republic of South Africa,Republic of Tajikistan,Republic of the Philippines,Republic of the Sudan,Somalia,South Sudan,State of Eritrea,State of Israel,Syrian Arab Republic,United Republic of Tanzania",relevant,,Web
20150129013041272,2015-01-29T19:30:40.399Z,"IRIN Middle East | Fighting, fuel fires and fear in Tripoli | Libya | Conflict | Economy | Environment | Governance | Security | Urban Risk",http://www.irinnews.org:80/Report/100539/Fighting-fuel-fires-and-fear-in-Tripoli,,"Arab Republic of Egypt,Bangladesh,Burkina Faso,Central African Republic,Democratic Socialist Republic of Sri Lanka,Eswatini,Federal Democratic Republic of Ethiopia,Gabonese Republic,Gambia,Independent State of Papua New Guinea,Islamic Republic of Afghanistan,Islamic Republic of Iran,Islamic Republic of Pakistan,Kingdom of Cambodia,Kingdom of Thailand,Libya,Republic of Angola,Republic of Benin,Republic of Botswana,Republic of Burundi,Republic of Cabo Verde,Republic of Cameroon,Republic of Chad,Republic of Djibouti,Republic of Equatorial Guinea,Republic of Ghana,Republic of Haiti,Republic of Indonesia,Republic of Iraq,Republic of Rwanda,Republic of Sierra Leone,Republic of South Africa,Republic of Tajikistan,Republic of the Philippines,Republic of the Sudan,Somalia,State of Eritrea,State of Israel,Syrian Arab Republic,United Republic of Tanzania",relevant,,Web
20150203125959355,2015-02-03T07:18:23.798Z,IRIN Africa | South Sudan peace: Deal? What deal? | South Sudan | Conflict,http://www.irinnews.org:80/Report/101082/South-Sudan-peace-Deal-What-deal,,"Arab Republic of Egypt,Bangladesh,Burkina Faso,Central African Republic,Democratic Socialist Republic of Sri Lanka,Eswatini,Federal Democratic Republic of Ethiopia,Gabonese Republic,Gambia,Independent State of Papua New Guinea,Islamic Republic of Afghanistan,Islamic Republic of Iran,Islamic Republic of Pakistan,Kingdom of Cambodia,Kingdom of Thailand,Republic of Angola,Republic of Benin,Republic of Botswana,Republic of Burundi,Republic of Cabo Verde,Republic of Cameroon,Republic of Chad,Republic of Djibouti,Republic of Equatorial Guinea,Republic of Ghana,Republic of Haiti,Republic of Indonesia,Republic of Iraq,Republic of Kenya,Republic of Rwanda,Republic of Sierra Leone,Republic of South Africa,Republic of Tajikistan,Republic of Uganda,Republic of the Philippines,Republic of the Sudan,Somalia,South Sudan,State of Eritrea,State of Israel,Syrian Arab Republic,United Republic of Tanzania",relevant,,Web
20190401042448315,2015-01-13T06:00:00Z,AFPTV-Advisory 1600GMT,https://advance.lexis.com/api/document?collection=News&id=urn:contentItem:5F2M-RDK1-JBV1-X08R-00000-00&context=1516831,Agence France Presse - English,"Argentine Republic\, Argentina,Czechia,Democratic Socialist Republic of Sri Lanka\, Sri Lanka,Federal Republic of Nigeria\, Nigeria,Hong Kong Special Administrative Region\, Hong Kong,Islamic Republic of Iran\, Iran,Islamic Republic of Pakistan\, Pakistan,Kingdom of Morocco\, Morocco,Lebanon,Mexico,Oriental Republic of Uruguay\, Uruguay,People's Republic of China\, China,Repubblica Italiana\, Italy,Republic of Bulgaria\, Bulgaria,Republic of Cameroon\, Cameroon,Republic of Chad\, Chad,Republic of Colombia\, Colombia,Republic of Cote d'Ivoire\, Ivory Coast,Republic of Cuba\, Cuba,Republic of Equatorial Guinea\, Equatorial Guinea,Republic of France\, France,Republic of Guinea\, Guinea,Republic of Haiti\, Haiti,Republic of India\, India,Republic of Indonesia\, Indonesia,Republic of Madagascar\, Madagascar,Republic of Mali\, Mali,Republic of Niger\, Niger,Republic of South Africa\, South Africa,Republic of Tunisia\, Tunisia,Republic of Uganda\, Uganda,State of Israel\, Israel,Syrian Arab Republic\, Syria,Ukraine,United Arab Emirates",relevant,,BulkLexisNexis
20150129012603187,2015-01-29T19:26:02.218Z,IRIN Africa | Ebola's economic impact hits Sierra Leone citizens | Guinea | Liberia | Sierra Leone | Ebola Crisis | Economy | Food Security | Governance | Health & Nutrition | Urban Risk | Water & Sanitation,http://www.irinnews.org:80/Report/100629/Ebola-apos-s-economic-impact-hits-Sierra-Leone-citizens,,"Arab Republic of Egypt,Bangladesh,Burkina Faso,Central African Republic,Democratic Socialist Republic of Sri Lanka,Eswatini,Federal Democratic Republic of Ethiopia,Gabonese Republic,Gambia,Independent State of Papua New Guinea,Islamic Republic of Afghanistan,Islamic Republic of Iran,Islamic Republic of Pakistan,Kingdom of Cambodia,Kingdom of Thailand,People's Republic of China,Republic of Angola,Republic of Benin,Republic of Botswana,Republic of Burundi,Republic of Cabo Verde,Republic of Cameroon,Republic of Chad,Republic of Djibouti,Republic of Equatorial Guinea,Republic of Ghana,Republic of Guinea,Republic of Haiti,Republic of Indonesia,Republic of Iraq,Republic of Kenya,Republic of Liberia,Republic of Rwanda,Republic of Sierra Leone,Republic of South Africa,Republic of Tajikistan,Republic of the Philippines,Republic of the Sudan,Somalia,State of Eritrea,State of Israel,Syrian Arab Republic,United Kingdom of Great Britain and Northern Ireland,United Republic of Tanzania",relevant,,Web
20150130125964654,2015-01-30T18:16:19.365Z,IRIN Global | Sexual violence in conflict – what use is the law? | Congo | Iraq | Conflict | Gender Issues,http://www.irinnews.org:80/Report/101068/Sexual-violence-in-conflict-what-use-is-the-law,,"Arab Republic of Egypt,Bangladesh,Bosnia and Herzegovina,Burkina Faso,Central African Republic,Democratic Republic of the Congo,Democratic Socialist Republic of Sri Lanka,Eswatini,Federal Democratic Republic of Ethiopia,Federal Republic of Yugoslavia,Gabonese Republic,Gambia,Independent State of Papua New Guinea,Islamic Republic of Afghanistan,Islamic Republic of Iran,Islamic Republic of Pakistan,Kingdom of Cambodia,Kingdom of Thailand,Republic of Angola,Republic of Benin,Republic of Botswana,Republic of Burundi,Republic of Cabo Verde,Republic of Cameroon,Republic of Chad,Republic of Djibouti,Republic of Equatorial Guinea,Republic of Ghana,Republic of Haiti,Republic of Indonesia,Republic of Iraq,Republic of Liberia,Republic of Rwanda,Republic of Sierra Leone,Republic of South Africa,Republic of Tajikistan,Republic of the Congo,Republic of the Philippines,Republic of the Sudan,Somalia,State of Eritrea,State of Israel,Syrian Arab Republic,United Kingdom of Great Britain and Northern Ireland,United Republic of Tanzania",relevant,,Web
20150205125956470,2015-02-05T10:00:00Z,allAfrica.com: Zimbabwe: President's Crowning Moment,http://allafrica.com:80/stories/201502050749.html,,"Commonwealth of Australia,Islamic Republic of Iran,Kingdom of Cambodia,Libya,Republic of Angola,Republic of Cameroon,Republic of Equatorial Guinea,Republic of France,Republic of Iraq,Republic of Mozambique,Republic of South Africa,Republic of Uganda,Republic of Zimbabwe,Union of Soviet Socialist Republics,United Kingdom of Great Britain and Northern Ireland,United States",relevant,,Web
20150306125957017,2015-03-06T08:19:52.298Z,IRIN Africa | South Sudan's delayed peace means no justice for war crime victims | South Sudan | Conflict | Governance | Human Rights,http://www.irinnews.org:80/Report/101201/South-Sudan-apos-s-delayed-peace-means-no-justice-for-war-crime-victims,,"Arab Republic of Egypt,Bangladesh,Burkina Faso,Central African Republic,Democratic Socialist Republic of Sri Lanka,Eswatini,Federal Democratic Republic of Ethiopia,Gabonese Republic,Gambia,Independent State of Papua New Guinea,Islamic Republic of Afghanistan,Islamic Republic of Iran,Islamic Republic of Pakistan,Kingdom of Cambodia,Kingdom of Thailand,Republic of Angola,Republic of Benin,Republic of Botswana,Republic of Burundi,Republic of Cabo Verde,Republic of Cameroon,Republic of Chad,Republic of Djibouti,Republic of Equatorial Guinea,Republic of Ghana,Republic of Haiti,Republic of Indonesia,Republic of Iraq,Republic of Rwanda,Republic of Sierra Leone,Republic of South Africa,Republic of Tajikistan,Republic of the Philippines,Republic of the Sudan,Somalia,South Sudan,State of Eritrea,State of Israel,Syrian Arab Republic,United Republic of Tanzania",relevant,,Web
20150403125962399,2015-04-03T10:32:03.071Z,IRIN Middle East | Is the Saudi war on Yemen legal? | Saudi Arabia | Yemen | Conflict,http://www.irinnews.org:80/Report/101320/Is-the-Saudi-war-on-Yemen-legal,,"Arab Republic of Egypt,Bangladesh,Burkina Faso,Central African Republic,Democratic Socialist Republic of Sri Lanka,Eswatini,Federal Democratic Republic of Ethiopia,Gabonese Republic,Gambia,Independent State of Papua New Guinea,Islamic Republic of Afghanistan,Islamic Republic of Iran,Islamic Republic of Pakistan,Kingdom of Cambodia,Kingdom of Saudi Arabia,Kingdom of Thailand,Republic of Angola,Republic of Benin,Republic of Botswana,Republic of Burundi,Republic of Cabo Verde,Republic of Cameroon,Republic of Chad,Republic of Djibouti,Republic of Equatorial Guinea,Republic of Ghana,Republic of Haiti,Republic of Indonesia,Republic of Iraq,Republic of Rwanda,Republic of Sierra Leone,Republic of South Africa,Republic of Tajikistan,Republic of Yemen,Republic of the Philippines,Republic of the Sudan,Russian Federation,Somalia,State of Eritrea,State of Israel,Syrian Arab Republic,United Kingdom of Great Britain and Northern Ireland,United Republic of Tanzania,United States",relevant,,Web
20150129012703852,2015-01-29T19:27:02.906Z,IRIN Asia | Burning issues facing Sri Lanka ahead of January polls | Sri Lanka | Economy | Governance | Refugees/IDPs,http://www.irinnews.org:80/Report/100946/Burning-issues-facing-Sri-Lanka-ahead-of-January-polls,,"Arab Republic of Egypt,Bangladesh,Burkina Faso,Central African Republic,Democratic Socialist Republic of Sri Lanka,Eswatini,Federal Democratic Republic of Ethiopia,Gabonese Republic,Gambia,Independent State of Papua New Guinea,Islamic Republic of Afghanistan,Islamic Republic of Iran,Islamic Republic of Pakistan,Kingdom of Cambodia,Kingdom of Thailand,Republic of Angola,Republic of Benin,Republic of Botswana,Republic of Burundi,Republic of Cabo Verde,Republic of Cameroon,Republic of Chad,Republic of Djibouti,Republic of Equatorial Guinea,Republic of Ghana,Republic of Haiti,Republic of India,Republic of Indonesia,Republic of Iraq,Republic of Rwanda,Republic of Sierra Leone,Republic of South Africa,Republic of Tajikistan,Republic of the Philippines,Republic of the Sudan,Somalia,State of Eritrea,State of Israel,Syrian Arab Republic,United Republic of Tanzania",relevant,,Web
20150202125959536,2015-02-02T07:15:03.982Z,IRIN Middle East | Has Syria really beaten polio? | Iraq | Syria | Conflict | Health & Nutrition | Refugees/IDPs,http://www.irinnews.org:80/Report/101076/Has-Syria-really-beaten-polio,,"Arab Republic of Egypt,Bangladesh,Burkina Faso,Central African Republic,Democratic Socialist Republic of Sri Lanka,Eswatini,Federal Democratic Republic of Ethiopia,Gabonese Republic,Gambia,Independent State of Papua New Guinea,Islamic Republic of Afghanistan,Islamic Republic of Iran,Islamic Republic of Pakistan,Kingdom of Cambodia,Kingdom of Thailand,Republic of Angola,Republic of Benin,Republic of Botswana,Republic of Burundi,Republic of Cabo Verde,Republic of Cameroon,Republic of Chad,Republic of Djibouti,Republic of Equatorial Guinea,Republic of Ghana,Republic of Haiti,Republic of Indonesia,Republic of Iraq,Republic of Rwanda,Republic of Sierra Leone,Republic of South Africa,Republic of Tajikistan,Republic of the Philippines,Republic of the Sudan,Somalia,State of Eritrea,State of Israel,Syrian Arab Republic,United Republic of Tanzania",relevant,,Web
20150123125976533,2015-01-24T05:32:26.296Z,"Full Text and Video of NSA Sambo Dasuki’s famous presentation at Chatham House, London - Premium Times Nigeria",http://www.premiumtimesng.com:80/news/headlines/175497-full-text-video-nsa-sambo-dasukis-famous-presentation-chatham-house-london.html,,"Federal Republic of Nigeria,Republic of Benin,Republic of Cameroon,Republic of Chad,Republic of Niger,United Kingdom of Great Britain and Northern Ireland,United States",relevant,,Web
20150401125979029,2015-04-02T03:02:59.736Z,Can an ex-dictator clean up Nigeria? - CNN.com,http://rss.cnn.com:80/~r/rss/edition_africa/~3/m-mRCfiT2mM/index.html,,"Argentine Republic,Federal Republic of Nigeria,Federative Republic of Brazil,Republic of Cameroon,United Kingdom of Great Britain and Northern Ireland",relevant,,Web
20150115125965449,2015-01-15T14:15:04.755Z,IRIN Africa | Cows and conflict: South Sudan's “slow motion” livestock crisis | South Sudan | Uganda | Conflict | Food Security,http://www.irinnews.org:80/Report/101012/Cows-and-conflict-South-Sudan-apos-s-slow-motion-livestock-crisis,,"Arab Republic of Egypt,Bangladesh,Burkina Faso,Central African Republic,Democratic Socialist Republic of Sri Lanka,Eswatini,Federal Democratic Republic of Ethiopia,Gabonese Republic,Gambia,Independent State of Papua New Guinea,Islamic Republic of Afghanistan,Islamic Republic of Iran,Islamic Republic of Pakistan,Kingdom of Cambodia,Kingdom of Thailand,Republic of Angola,Republic of Benin,Republic of Botswana,Republic of Burundi,Republic of Cabo Verde,Republic of Cameroon,Republic of Chad,Republic of Djibouti,Republic of Equatorial Guinea,Republic of Ghana,Republic of Haiti,Republic of Indonesia,Republic of Iraq,Republic of Kenya,Republic of Rwanda,Republic of Sierra Leone,Republic of South Africa,Republic of Tajikistan,Republic of Uganda,Republic of the Philippines,Republic of the Sudan,Somalia,South Sudan,State of Eritrea,State of Israel,Syrian Arab Republic,United Republic of Tanzania",relevant,,Web
20150129011449606,2015-01-29T19:14:48.480Z,IRIN Africa | Cows and conflict: South Sudan's “slow motion” livestock crisis | South Sudan | Uganda | Conflict | Food Security,http://www.irinnews.org:80/Report/101012/Cows-and-conflict-South-Sudan-apos-s-slow-motion-livestock-crisis,,"Arab Republic of Egypt,Bangladesh,Burkina Faso,Central African Republic,Democratic Socialist Republic of Sri Lanka,Eswatini,Federal Democratic Republic of Ethiopia,Gabonese Republic,Gambia,Independent State of Papua New Guinea,Islamic Republic of Afghanistan,Islamic Republic of Iran,Islamic Republic of Pakistan,Kingdom of Cambodia,Kingdom of Thailand,Republic of Angola,Republic of Benin,Republic of Botswana,Republic of Burundi,Republic of Cabo Verde,Republic of Cameroon,Republic of Chad,Republic of Djibouti,Republic of Equatorial Guinea,Republic of Ghana,Republic of Haiti,Republic of Indonesia,Republic of Iraq,Republic of Kenya,Republic of Rwanda,Republic of Sierra Leone,Republic of South Africa,Republic of Tajikistan,Republic of Uganda,Republic of the Philippines,Republic of the Sudan,Somalia,South Sudan,State of Eritrea,State of Israel,Syrian Arab Republic,United Republic of Tanzania",relevant,,Web
20150318125974427,2015-03-18T19:31:41.158Z,IRIN Africa | Women and malnutrition – the case of South Sudan | South Sudan | Disaster Risk Reduction | Health & Nutrition,http://www.irinnews.org:80/Report/101250/Women-and-malnutrition-the-case-of-South-Sudan,,"Arab Republic of Egypt,Bangladesh,Burkina Faso,Central African Republic,Democratic Socialist Republic of Sri Lanka,Eswatini,Federal Democratic Republic of Ethiopia,Gabonese Republic,Gambia,Independent State of Papua New Guinea,Islamic Republic of Afghanistan,Islamic Republic of Iran,Islamic Republic of Pakistan,Kingdom of Cambodia,Kingdom of Thailand,Republic of Angola,Republic of Benin,Republic of Botswana,Republic of Burundi,Republic of Cabo Verde,Republic of Cameroon,Republic of Chad,Republic of Djibouti,Republic of Equatorial Guinea,Republic of Ghana,Republic of Haiti,Republic of Indonesia,Republic of Iraq,Republic of Rwanda,Republic of Sierra Leone,Republic of South Africa,Republic of Tajikistan,Republic of the Philippines,Republic of the Sudan,Somalia,South Sudan,State of Eritrea,State of Israel,Syrian Arab Republic,United Republic of Tanzania",irrelevant,,Web
20150123125964731,2015-01-23T15:49:09.653Z,There is nothing wrong with us delaying elections - NSA - Vanguard News,http://www.vanguardngr.com:80/2015/01/nothing-wrong-us-delaying-elections-nsa/,,"Federal Republic of Nigeria,Republic of Benin,Republic of Cameroon,Republic of Chad,Republic of Niger,United Kingdom of Great Britain and Northern Ireland",relevant,,Web
20150122125974299,2015-01-22T20:12:04.623Z,"Dasuki at Chatham House, London, Promises Violence-free Elections in February - Metro Watch",http://metrowatchonline.com:80/dasuki-chatham-house-london-promises-violence-free-elections-february/,,"Federal Republic of Nigeria,Republic of Benin,Republic of Cameroon,Republic of Chad,Republic of Niger,United Kingdom of Great Britain and Northern Ireland",relevant,,Web
20150129014725714,2015-01-29T19:47:24.736Z,IRIN Middle East | Threat of disease in Iraq villages flooded by militants | Iraq | Conflict | Water & Sanitation,http://www.irinnews.org:80/Report/100134/Threat-of-disease-in-Iraq-villages-flooded-by-militants,,"Arab Republic of Egypt,Bangladesh,Burkina Faso,Central African Republic,Democratic Socialist Republic of Sri Lanka,Eswatini,Federal Democratic Republic of Ethiopia,Gabonese Republic,Gambia,Independent State of Papua New Guinea,Islamic Republic of Afghanistan,Islamic Republic of Iran,Islamic Republic of Pakistan,Kingdom of Cambodia,Kingdom of Thailand,Republic of Angola,Republic of Benin,Republic of Botswana,Republic of Burundi,Republic of Cabo Verde,Republic of Cameroon,Republic of Chad,Republic of Djibouti,Republic of Equatorial Guinea,Republic of Ghana,Republic of Haiti,Republic of Indonesia,Republic of Iraq,Republic of Rwanda,Republic of Sierra Leone,Republic of South Africa,Republic of Tajikistan,Republic of the Philippines,Republic of the Sudan,Somalia,State of Eritrea,State of Israel,Syrian Arab Republic,United Republic of Tanzania",relevant,,Web
20150129014345835,2015-01-29T19:43:44.820Z,IRIN Africa | Briefing: South Sudan heads towards famine | South Sudan | Aid Policy | Children | Conflict | Early Warning | Economy,http://www.irinnews.org:80/Report/100422/Briefing-South-Sudan-heads-towards-famine,,"Arab Republic of Egypt,Bangladesh,Burkina Faso,Central African Republic,Democratic Socialist Republic of Sri Lanka,Eswatini,Federal Democratic Republic of Ethiopia,Gabonese Republic,Gambia,Independent State of Papua New Guinea,Islamic Republic of Afghanistan,Islamic Republic of Iran,Islamic Republic of Pakistan,Kingdom of Cambodia,Kingdom of Thailand,Republic of Angola,Republic of Benin,Republic of Botswana,Republic of Burundi,Republic of Cabo Verde,Republic of Cameroon,Republic of Chad,Republic of Djibouti,Republic of Equatorial Guinea,Republic of Ghana,Republic of Haiti,Republic of Indonesia,Republic of Iraq,Republic of Rwanda,Republic of Sierra Leone,Republic of South Africa,Republic of Tajikistan,Republic of Uganda,Republic of the Philippines,Republic of the Sudan,Somalia,South Sudan,State of Eritrea,State of Israel,Syrian Arab Republic,United Republic of Tanzania,United States",relevant,,Web
20150127125965954,2015-01-27T14:20:33.945Z,IRIN Middle East | Inside Libya's ghost town | Libya | Conflict | Security,http://www.irinnews.org:80/Report/101052/Inside-Libya-apos-s-ghost-town,,"Arab Republic of Egypt,Bangladesh,Burkina Faso,Central African Republic,Democratic Socialist Republic of Sri Lanka,Eswatini,Federal Democratic Republic of Ethiopia,Gabonese Republic,Gambia,Independent State of Papua New Guinea,Islamic Republic of Afghanistan,Islamic Republic of Iran,Islamic Republic of Pakistan,Kingdom of Cambodia,Kingdom of Thailand,Libya,Republic of Angola,Republic of Benin,Republic of Botswana,Republic of Burundi,Republic of Cabo Verde,Republic of Cameroon,Republic of Chad,Republic of Djibouti,Republic of Equatorial Guinea,Republic of Ghana,Republic of Haiti,Republic of Indonesia,Republic of Iraq,Republic of Rwanda,Republic of Sierra Leone,Republic of South Africa,Republic of Tajikistan,Republic of Tunisia,Republic of the Philippines,Republic of the Sudan,Somalia,State of Eritrea,State of Israel,Syrian Arab Republic,United Republic of Tanzania",relevant,,Web
20190401043230686,2015-01-22T06:00:00Z,AFPTV Advisory 1000 GMT,https://advance.lexis.com/api/document?collection=News&id=urn:contentItem:5F4J-G271-JBV1-X1FW-00000-00&context=1516831,Agence France Presse - English,"Argentine Republic\, Argentina,Bolivarian Republic of Venezuela\, Venezuela,Burkina Faso,Federal Democratic Republic of Nepal\, Patheka\, Nepal,Federal Republic of Germany\, Germany,Federal Republic of Nigeria\, Nigeria,Gabonese Republic\, Gabon,Hellenic Republic\, Greece,Hong Kong Special Administrative Region\, Hong Kong,Japan,Kingdom of Spain\, Spain,New Zealand,Oriental Republic of Uruguay\, Uruguay,People's Democratic Republic of Algeria\, Algeria,People's Republic of China\, China,Plurinational State of Bolivia\, Bolivia,Republic of Cameroon\, Cameroon,Republic of Cote d'Ivoire\, Ivory Coast,Republic of Cuba\, Cuba,Republic of Cyprus\, Cyprus,Republic of Equatorial Guinea\, Equatorial Guinea,Republic of France\, France,Republic of Ghana\, Ghana,Republic of Guinea\, Guinea,Republic of Iraq\, Iraq,Republic of Malawi\, Malawi,Republic of Mali\, Mali,Republic of Mozambique\, Mozambique,Republic of Poland\, Poland,Republic of Yemen\, Yemen,South Sudan,State of Israel\, Israel,Switzerland,Syrian Arab Republic\, Syria,Ukraine,United Kingdom of Great Britain and Northern Ireland\, United Kingdom,United Republic of Tanzania\, Tanzania,United States",relevant,,BulkLexisNexis
20190401043230508,2015-01-22T06:00:00Z,AFPTV Advisory 1600 GMT,https://advance.lexis.com/api/document?collection=News&id=urn:contentItem:5F4J-G271-JBV1-X1SM-00000-00&context=1516831,Agence France Presse - English,"Bolivarian Republic of Venezuela\, Venezuela,Democratic Republic of the Congo,Federal Democratic Republic of Nepal\, Patheka\, Nepal,Federal Republic of Germany\, Germany,Federal Republic of Nigeria\, Nigeria,Hellenic Republic\, Greece,Hong Kong Special Administrative Region\, Hong Kong,Japan,Oriental Republic of Uruguay\, Uruguay,People's Republic of China\, China,Plurinational State of Bolivia\, Bolivia,Republic of Cabo Verde\, Cape Verde,Republic of Cameroon\, Cameroon,Republic of Cote d'Ivoire\, Ivory Coast,Republic of Cuba\, Cuba,Republic of Equatorial Guinea\, Equatorial Guinea,Republic of France\, France,Republic of Guinea\, Guinea,Republic of Iraq\, Iraq,Republic of Malawi\, Malawi,Republic of Mali\, Mali,Republic of Mozambique\, Mozambique,Republic of Poland\, Poland,Republic of Tunisia\, Tunisia,Republic of Yemen\, Yemen,Republic of Zambia\, Zambia,South Sudan,Switzerland,Syrian Arab Republic\, Syria,Ukraine,Union of Burma\, Myanmar,United Republic of Tanzania\, Tanzania,United States",relevant,,BulkLexisNexis
20150203125975320,2015-02-03T23:27:37.549Z,Failed generation: Mr. President is damn right | Newswatch Times,http://www.mynewswatchtimesng.com:80/failed-generation-mr-president-damn-right-2/,,"Federal Republic of Nigeria,Republic of Cameroon,United Kingdom of Great Britain and Northern Ireland,United States",relevant,,Web
20150330125958505,2015-03-30T07:28:44.788Z,,http://www.menafn.com:80/1094143995/Trade-exchange-largely-affected-after-Arab-Spring?src=RSS,,"Arab Republic of Egypt,Central African Republic,Hashemite Kingdom of Jordan,Islamic Republic of Iran,Kingdom of Saudi Arabia,Libya,People's Republic of China,Republic of Cameroon,Republic of Iraq,Republic of Tunisia,Republic of Yemen,Romania,State of Kuwait,Syrian Arab Republic,United Arab Emirates",irrelevant,,Web
